index,Release Date,Title_x,Production Budget,Domestic Gross,Worldwide Gross,Response,Error,Title_y,Year,Rated,Released,Runtime,Genre,Director,Writer,Actors,Plot,Language,Country,Awards,Poster,Ratings,Metascore,imdbRating,imdbVotes,imdbID,Type,DVD,BoxOffice,Production,Website,totalSeasons
0,"Dec 16, 2015",Star Wars Ep. VII: The Force Awakens,"$533,200,000","$936,662,225","$2,056,046,835",False,Movie not found!,,,,,,,,,,,,,,,,,,,,,,,,,
1,"Apr 23, 2019",Avengers: Endgame,"$400,000,000","$858,373,000","$2,717,503,922",True,,Avengers: Endgame,2019,PG-13,26 Apr 2019,181 min,"Action, Adventure, Sci-Fi","Anthony Russo, Joe Russo","Christopher Markus, Stephen McFeely, Stan Lee","Robert Downey Jr., Chris Evans, Mark Ruffalo","After the devastating events of Avengers: Infinity War (2018), the universe is in ruins. With the help of remaining allies, the Avengers assemble once more in order to reverse Thanos' actions and restore balance to the universe.","English, Japanese, Xhosa, German",United States,Nominated for 1 Oscar. 70 wins & 132 nominations total,https://m.media-amazon.com/images/M/MV5BMTc5MDE2ODcwNV5BMl5BanBnXkFtZTgwMzI2NzQ2NzM@._V1_SX300.jpg,"[{'Source': 'Internet Movie Database', 'Value': '8.4/10'}, {'Source': 'Rotten Tomatoes', 'Value': '94%'}, {'Source': 'Metacritic', 'Value': '78/100'}]",78,8.4,"1,390,337",tt4154796,movie,N/A,"$858,373,000",N/A,N/A,
2,"Dec 9, 2022",Avatar: The Way of Water,"$400,000,000","$688,809,501","$2,322,902,023",True,,Avatar: The Way of Water,2022,PG-13,16 Dec 2022,192 min,"Action, Adventure, Fantasy",James Cameron,"James Cameron, Rick Jaffa, Amanda Silver","Sam Worthington, Zoe Saldaña, Sigourney Weaver","Jake Sully lives with his newfound family formed on the extrasolar moon Pandora. Once a familiar threat returns to finish what was previously started, Jake must work with Neytiri and the army of the Na'vi race to protect their home.",English,United States,Won 1 Oscar. 73 wins & 152 nominations total,https://m.media-amazon.com/images/M/MV5BMWNlMWQyMTQtZjc5MC00NTljLTgxZTctZDZiZTBmODY5MTkyXkEyXkFqcGc@._V1_SX300.jpg,"[{'Source': 'Internet Movie Database', 'Value': '7.5/10'}, {'Source': 'Rotten Tomatoes', 'Value': '76%'}, {'Source': 'Metacritic', 'Value': '67/100'}]",67,7.5,"546,561",tt1630029,movie,N/A,"$684,075,767",N/A,N/A,
3,"May 17, 2025",Mission: Impossible—The Final Reckoning,"$400,000,000","$197,413,515","$591,353,074",True,,Mission: Impossible - The Final Reckoning,2025,PG-13,23 May 2025,169 min,"Action, Adventure, Thriller",Christopher McQuarrie,"Bruce Geller, Christopher McQuarrie, Erik Jendresen","Tom Cruise, Hayley Atwell, Ving Rhames","Hunt and the IMF pursue a dangerous AI called the Entity that's infiltrated global intelligence. With governments and a figure from his past in pursuit, Hunt races to stop it from forever changing the world.","English, French, Russian","United Kingdom, United States",6 wins & 3 nominations total,https://m.media-amazon.com/images/M/MV5BZGQ5NGEyYTItMjNiMi00Y2EwLTkzOWItMjc5YjJiMjMyNTI0XkEyXkFqcGc@._V1_SX300.jpg,"[{'Source': 'Internet Movie Database', 'Value': '7.3/10'}, {'Source': 'Rotten Tomatoes', 'Value': '80%'}, {'Source': 'Metacritic', 'Value': '67/100'}]",67,7.3,"160,935",tt9603208,movie,N/A,"$197,413,515",N/A,N/A,
4,"May 20, 2011",Pirates of the Caribbean: On Stranger Tides,"$379,000,000","$241,071,802","$1,045,713,802",True,,Pirates of the Caribbean: On Stranger Tides,2011,PG-13,20 May 2011,136 min,"Action, Adventure, Fantasy",Rob Marshall,"Ted Elliott, Terry Rossio, Stuart Beattie","Johnny Depp, Penélope Cruz, Ian McShane","Jack Sparrow and Barbossa embark on a quest to find the elusive fountain of youth, only to discover that Blackbeard and his daughter are after it too.","English, Spanish","United States, United Kingdom",3 wins & 31 nominations total,https://m.media-amazon.com/images/M/MV5BMjE5MjkwODI3Nl5BMl5BanBnXkFtZTcwNjcwMDk4NA@@._V1_SX300.jpg,"[{'Source': 'Internet Movie Database', 'Value': '6.6/10'}, {'Source': 'Rotten Tomatoes', 'Value': '32%'}, {'Source': 'Metacritic', 'Value': '45/100'}]",45,6.6,"594,656",tt1298650,movie,N/A,"$241,071,802",N/A,N/A,
5,"Apr 22, 2015",Avengers: Age of Ultron,"$365,000,000","$459,005,868","$1,395,316,979",True,,Avengers: Age of Ultron,2015,PG-13,01 May 2015,141 min,"Action, Adventure, Sci-Fi",Joss Whedon,"Joss Whedon, Stan Lee, Jack Kirby","Robert Downey Jr., Chris Evans, Mark Ruffalo","When Tony Stark and Bruce Banner try to jump-start a dormant peacekeeping program called Ultron, things go horribly wrong and it's up to Earth's mightiest heroes to stop the villainous Ultron from enacting his terrible plan.","English, Korean","United States, South Korea, Cambodia",8 wins & 52 nominations total,https://m.media-amazon.com/images/M/MV5BODBhYTg1NGQtNGVmNS00ZTdiLThjYTYtZDFkNzRiNTZmNDZjXkEyXkFqcGc@._V1_SX300.jpg,"[{'Source': 'Internet Movie Database', 'Value': '7.3/10'}, {'Source': 'Rotten Tomatoes', 'Value': '75%'}, {'Source': 'Metacritic', 'Value': '66/100'}]",66,7.3,"977,828",tt2395427,movie,N/A,"$459,005,868",N/A,N/A,
6,"May 17, 2023",Fast X,"$340,000,000","$146,126,015","$714,375,114",True,,Fast X,2023,PG-13,19 May 2023,141 min,"Action, Adventure, Crime",Louis Leterrier,"Dan Mazeau, Justin Lin, Zach Dean","Vin Diesel, Michelle Rodriguez, Jason Statham",Dom Toretto and his family are targeted by the vengeful son of drug kingpin Hernan Reyes.,"English, Spanish, French, Arabic, Portuguese, Italian","United States, China, Japan, Spain, United Kingdom, Iceland",2 wins & 19 nominations total,https://m.media-amazon.com/images/M/MV5BYzEwZjczOTktYzU1OS00YjJlLTgyY2UtNWEzODBlN2RjZDEwXkEyXkFqcGc@._V1_SX300.jpg,"[{'Source': 'Internet Movie Database', 'Value': '5.7/10'}, {'Source': 'Rotten Tomatoes', 'Value': '56%'}, {'Source': 'Metacritic', 'Value': '56/100'}]",56,5.7,"140,294",tt5433140,movie,N/A,"$146,126,015",N/A,N/A,
7,"May 23, 2018",Solo: A Star Wars Story,"$330,400,000","$213,767,512","$393,151,347",True,,Solo: A Star Wars Story,2018,PG-13,25 May 2018,135 min,"Action, Adventure, Sci-Fi",Ron Howard,"Jonathan Kasdan, Lawrence Kasdan, George Lucas","Alden Ehrenreich, Woody Harrelson, Emilia Clarke","During an adventure in the criminal underworld, Han Solo meets his future co-pilot Chewbacca and Lando Calrissian years before joining the Rebel Alliance.",English,United States,Nominated for 1 Oscar. 6 wins & 26 nominations total,https://m.media-amazon.com/images/M/MV5BOTM2NTI3NTc3Nl5BMl5BanBnXkFtZTgwNzM1OTQyNTM@._V1_SX300.jpg,"[{'Source': 'Internet Movie Database', 'Value': '6.9/10'}, {'Source': 'Rotten Tomatoes', 'Value': '69%'}, {'Source': 'Metacritic', 'Value': '62/100'}]",62,6.9,"401,121",tt3778644,movie,N/A,"$213,767,512",N/A,N/A,
8,"Apr 25, 2018",Avengers: Infinity War,"$300,000,000","$678,815,482","$2,048,158,241",True,,Avengers: Infinity War,2018,PG-13,27 Apr 2018,149 min,"Action, Adventure, Sci-Fi","Anthony Russo, Joe Russo","Christopher Markus, Stephen McFeely, Stan Lee","Robert Downey Jr., Chris Hemsworth, Mark Ruffalo",The Avengers and their allies must be willing to sacrifice all in an attempt to defeat the powerful Thanos before his blitz of devastation and ruin puts an end to the universe.,English,"United States, Norway",Nominated for 1 Oscar. 48 wins & 80 nominations total,https://m.media-amazon.com/images/M/MV5BMjMxNjY2MDU1OV5BMl5BanBnXkFtZTgwNzY1MTUwNTM@._V1_SX300.jpg,"[{'Source': 'Internet Movie Database', 'Value': '8.4/10'}, {'Source': 'Rotten Tomatoes', 'Value': '85%'}, {'Source': 'Metacritic', 'Value': '68/100'}]",68,8.4,"1,321,746",tt4154756,movie,N/A,"$678,815,482",N/A,N/A,
9,"May 24, 2007",Pirates of the Caribbean: At World’s End,"$300,000,000","$309,420,425","$960,996,492",True,,Pirates of the Caribbean: At World's End,2007,PG-13,25 May 2007,169 min,"Action, Adventure, Fantasy",Gore Verbinski,"Ted Elliott, Terry Rossio, Stuart Beattie","Johnny Depp, Orlando Bloom, Keira Knightley","Will Turner, Elizabeth Swann, Hector Barbossa, and the crew of the Black Pearl try and rescue Jack from davy jones locker and prepare to fight Lord Cutler Beckett, who controls Davy Jones and the Flying Dutchman.",English,United States,Nominated for 2 Oscars. 23 wins & 51 nominations total,https://m.media-amazon.com/images/M/MV5BMjIyNjkxNzEyMl5BMl5BanBnXkFtZTYwMjc3MDE3._V1_SX300.jpg,"[{'Source': 'Internet Movie Database', 'Value': '7.1/10'}, {'Source': 'Rotten Tomatoes', 'Value': '43%'}, {'Source': 'Metacritic', 'Value': '50/100'}]",50,7.1,"729,007",tt0449088,movie,N/A,"$309,420,425",N/A,N/A,
10,"Nov 13, 2017",Justice League,"$300,000,000","$229,024,295","$661,324,295",True,,Justice League,2017,PG-13,17 Nov 2017,120 min,"Action, Adventure, Fantasy",Zack Snyder,"Jerry Siegel, Joe Shuster, Chris Terrio","Ben Affleck, Gal Gadot, Jason Momoa","Steppenwolf and his Parademons return after eons to capture Earth. However, Batman seeks the help of Wonder Woman to recruit and assemble Flash, Cyborg and Aquaman to fight the powerful new enemy.","English, Irish Gaelic, Russian, Icelandic","United States, Canada, United Kingdom",2 wins & 15 nominations total,https://m.media-amazon.com/images/M/MV5BMjM5YmQxM2YtZjI2Yy00YjhhLTg5N2MtMTEyMzdlZDU3OTVhXkEyXkFqcGc@._V1_SX300.jpg,"[{'Source': 'Internet Movie Database', 'Value': '6.0/10'}, {'Source': 'Rotten Tomatoes', 'Value': '39%'}, {'Source': 'Metacritic', 'Value': '45/100'}]",45,6.0,"497,511",tt0974015,movie,N/A,"$229,024,295",N/A,N/A,
11,"Jun 28, 2023",Indiana Jones and the Dial of Destiny,"$300,000,000","$174,480,468","$383,963,057",True,,Indiana Jones and the Dial of Destiny,2023,PG-13,30 Jun 2023,154 min,"Action, Adventure, Sci-Fi",James Mangold,"Jez Butterworth, John-Henry Butterworth, David Koepp","Harrison Ford, Phoebe Waller-Bridge, Antonio Banderas",Archaeologist Indiana Jones races against time to retrieve a legendary artifact that can change the course of history.,"English, German, Greek, Ancient (to 1453), Spanish, Italian",United States,Nominated for 1 Oscar. 10 wins & 39 nominations total,https://m.media-amazon.com/images/M/MV5BYWJlOWE2ZjEtZGRhOC00M2YzLWFkZGEtYzIzZWI2Zjg3NWYxXkEyXkFqcGc@._V1_SX300.jpg,"[{'Source': 'Internet Movie Database', 'Value': '6.5/10'}, {'Source': 'Rotten Tomatoes', 'Value': '71%'}, {'Source': 'Metacritic', 'Value': '58/100'}]",58,6.5,"225,449",tt1462764,movie,N/A,"$174,480,468",N/A,N/A,
12,"Jul 11, 2023",Mission: Impossible Dead Reckoning Part One,"$290,000,000","$172,640,980","$565,696,302",True,,Mission: Impossible - Dead Reckoning Part One,2023,PG-13,12 Jul 2023,163 min,"Action, Adventure, Thriller",Christopher McQuarrie,"Bruce Geller, Christopher McQuarrie, Erik Jendresen","Tom Cruise, Hayley Atwell, Ving Rhames",Ethan Hunt and his IMF team must track down a dangerous weapon before it falls into the wrong hands.,"English, Italian, Russian, French",United States,Nominated for 2 Oscars. 18 wins & 68 nominations total,https://m.media-amazon.com/images/M/MV5BN2U4OTdmM2QtZTkxYy00ZmQyLTg2N2UtMDdmMGJmNDhlZDU1XkEyXkFqcGc@._V1_SX300.jpg,"[{'Source': 'Internet Movie Database', 'Value': '7.6/10'}, {'Source': 'Rotten Tomatoes', 'Value': '96%'}, {'Source': 'Metacritic', 'Value': '81/100'}]",81,7.6,"313,421",tt9603212,movie,N/A,"$172,640,980",N/A,N/A,
13,"Dec 14, 2016",Rogue One: A Star Wars Story,"$280,200,000","$533,539,991","$1,055,083,596",True,,Rogue One: A Star Wars Story,2016,PG-13,16 Dec 2016,133 min,"Action, Adventure, Sci-Fi",Gareth Edwards,"Chris Weitz, Tony Gilroy, John Knoll","Felicity Jones, Diego Luna, Alan Tudyk","In a time of conflict, a group of unlikely heroes band together on a mission to steal the plans to the Death Star, the Empire's ultimate weapon of destruction.",English,United States,Nominated for 2 Oscars. 24 wins & 85 nominations total,https://m.media-amazon.com/images/M/MV5BMjEwMzMxODIzOV5BMl5BanBnXkFtZTgwNzg3OTAzMDI@._V1_SX300.jpg,"[{'Source': 'Internet Movie Database', 'Value': '7.8/10'}, {'Source': 'Rotten Tomatoes', 'Value': '84%'}, {'Source': 'Metacritic', 'Value': '65/100'}]",65,7.8,"737,143",tt3748528,movie,N/A,"$533,539,991",N/A,N/A,
14,"Dec 18, 2019",Star Wars: The Rise of Skywalker,"$275,000,000","$515,202,542","$1,069,951,814",True,,RiffTrax: Star Wars - The Rise of Skywalker,2020,TV-14,03 Apr 2020,N/A,"Comedy, Sci-Fi",N/A,"Bill Corbett, Conor Lastowka, Jason Miller","Bill Corbett, Kevin Murphy, Michael J. Nelson","Ever since the original premiered in 1977, Star Wars fans have waited to see how the Skywalker saga would end.",English,United States,N/A,https://m.media-amazon.com/images/M/MV5BZGFiZWNkNTItNmJkMy00NzRmLWE0ZTItMzk2ZDVmODI0ZmFmXkEyXkFqcGc@._V1_SX300.jpg,[],N/A,N/A,44,tt15662564,movie,N/A,N/A,N/A,N/A,
15,"Nov 8, 2023",The Marvels,"$270,000,000","$84,500,223","$206,136,825",True,,The Marvels,2023,PG-13,10 Nov 2023,105 min,"Action, Adventure, Sci-Fi",Nia DaCosta,"Nia DaCosta, Megan McDonnell, Elissa Karasik","Brie Larson, Teyonah Parris, Iman Vellani","Carol Danvers gets her powers entangled with those of Kamala Khan and Monica Rambeau, forcing them to work together to save the universe.","English, Urdu",United States,5 wins & 13 nominations total,https://m.media-amazon.com/images/M/MV5BYzczOWM4MzItMWMyOS00ZDczLWIxMzctNzBmYTgzOTI1MzI3XkEyXkFqcGc@._V1_SX300.jpg,"[{'Source': 'Internet Movie Database', 'Value': '5.5/10'}, {'Source': 'Rotten Tomatoes', 'Value': '63%'}, {'Source': 'Metacritic', 'Value': '50/100'}]",50,5.5,"156,936",tt10676048,movie,N/A,"$84,500,223",N/A,N/A,
16,"Mar 19, 2025",Disney’s Snow White,"$269,400,000","$87,203,963","$205,679,463",True,,Disney's 'Snow White and the Seven Dwarfs': Still the Fairest of Them All,2001,Unrated,09 Oct 2001,39 min,"Documentary, Short, Family",Harry Arends,"Harry Arends, Phil Savenick","Angela Lansbury, Ken Anderson, Rudy Behlmer, Jeff Bennett","Released as a Bonus Feature for Disney's Platinum DVD Edition of ""Snow White and the Seven Dwarfs"" this short documentary shows how this classic film came to life.",English,USA,N/A,https://m.media-amazon.com/images/M/MV5BZmRhZWNkODctMWViNy00NDY5LWEyNWMtYzAyYTM1YzQwN2YzXkEyXkFqcGdeQXVyNzg5OTk2OA@@._V1_SX300.jpg,"[{'Source': 'Internet Movie Database', 'Value': '8.0/10'}]",N/A,8.0,78,tt0344378,movie,N/A,N/A,N/A,N/A,
17,"Mar 7, 2012",John Carter,"$263,700,000","$73,058,679","$282,778,100",True,,John Carter,2012,PG-13,09 Mar 2012,132 min,"Action, Adventure, Sci-Fi",Andrew Stanton,"Andrew Stanton, Mark Andrews, Michael Chabon","Taylor Kitsch, Lynn Collins, Willem Dafoe",A war-weary former army captain is inexplicably transported to Mars and reluctantly becomes embroiled in a conflict of epic proportions.,English,United States,2 wins & 8 nominations total,https://m.media-amazon.com/images/M/MV5BZWNmZGYzZjUtODRmOS00ODgzLWE4NWQtMDI3MGUwNjRjYjY0XkEyXkFqcGc@._V1_SX300.jpg,"[{'Source': 'Internet Movie Database', 'Value': '6.6/10'}, {'Source': 'Rotten Tomatoes', 'Value': '52%'}, {'Source': 'Metacritic', 'Value': '51/100'}]",51,6.6,"294,974",tt0401729,movie,N/A,"$73,078,100",N/A,N/A,
18,"Mar 23, 2016",Batman v Superman: Dawn of Justice,"$263,000,000","$330,360,194","$874,360,194",True,,Batman v Superman: Dawn of Justice,2016,R,25 Mar 2016,151 min,"Action, Adventure, Sci-Fi",Zack Snyder,"Bob Kane, Bill Finger, Jerry Siegel","Ben Affleck, Henry Cavill, Amy Adams",Batman is manipulated by Lex Luthor to fear Superman. Superman´s existence is meanwhile dividing the world and he is framed for murder during an international crisis. The heroes clash and force the neutral Wonder Woman to reemerge.,English,"United States, Morocco",14 wins & 33 nominations total,https://m.media-amazon.com/images/M/MV5BZTJkYjdmYjYtOGMyNC00ZGU1LThkY2ItYTc1OTVlMmE2YWY1XkEyXkFqcGc@._V1_SX300.jpg,"[{'Source': 'Internet Movie Database', 'Value': '6.4/10'}, {'Source': 'Rotten Tomatoes', 'Value': '28%'}, {'Source': 'Metacritic', 'Value': '44/100'}]",44,6.4,"781,615",tt2975590,movie,N/A,"$330,360,194",N/A,N/A,
19,"Dec 13, 2017",Star Wars Ep. VIII: The Last Jedi,"$262,000,000","$620,181,382","$1,322,581,071",False,Movie not found!,,,,,,,,,,,,,,,,,,,,,,,,,
20,"Jul 11, 2019",The Lion King,"$260,000,000","$543,638,043","$1,661,454,403",True,,The Lion King,1994,G,24 Jun 1994,88 min,"Animation, Adventure, Drama","Roger Allers, Rob Minkoff","Irene Mecchi, Jonathan Roberts, Linda Woolverton","Matthew Broderick, Jeremy Irons, James Earl Jones","Lion prince Simba and his father are targeted by his bitter uncle, who wants to ascend the throne himself.","English, Swahili, Xhosa, Zulu",United States,Won 2 Oscars. 43 wins & 35 nominations total,https://m.media-amazon.com/images/M/MV5BZGRiZDZhZjItM2M3ZC00Y2IyLTk3Y2MtMWY5YjliNDFkZTJlXkEyXkFqcGc@._V1_SX300.jpg,"[{'Source': 'Internet Movie Database', 'Value': '8.5/10'}, {'Source': 'Rotten Tomatoes', 'Value': '92%'}, {'Source': 'Metacritic', 'Value': '88/100'}]",88,8.5,"1,223,797",tt0110357,movie,N/A,"$424,979,720",N/A,N/A,
21,"Nov 24, 2010",Tangled,"$260,000,000","$200,821,936","$581,940,081",True,,Tangled,2010,PG,24 Nov 2010,100 min,"Animation, Adventure, Comedy","Nathan Greno, Byron Howard","Dan Fogelman, Jacob Grimm, Wilhelm Grimm","Mandy Moore, Zachary Levi, Donna Murphy","The magically long-haired Rapunzel has spent her entire life in a tower, but now that a runaway thief has stumbled upon her, she is about to discover the world for the first time, and who she really is.","English, German","United States, Japan",Nominated for 1 Oscar. 10 wins & 42 nominations total,https://m.media-amazon.com/images/M/MV5BMTAxNDYxMjg0MjNeQTJeQWpwZ15BbWU3MDcyNTk2OTM@._V1_SX300.jpg,"[{'Source': 'Internet Movie Database', 'Value': '7.7/10'}, {'Source': 'Rotten Tomatoes', 'Value': '89%'}, {'Source': 'Metacritic', 'Value': '71/100'}]",71,7.7,"530,733",tt0398286,movie,N/A,"$200,821,936",N/A,N/A,
22,"May 3, 2007",Spider-Man 3,"$258,000,000","$338,007,351","$896,337,268",True,,Spider-Man 3,2007,PG-13,04 May 2007,139 min,"Action, Adventure, Sci-Fi",Sam Raimi,"Sam Raimi, Ivan Raimi, Alvin Sargent","Tobey Maguire, Kirsten Dunst, Topher Grace","A strange black entity from another world bonds with Peter Parker and causes inner turmoil as he contends with new villains, temptations, and revenge.","English, French",United States,Nominated for 1 BAFTA Award4 wins & 44 nominations total,https://m.media-amazon.com/images/M/MV5BODE2NzNhMDctYjUzMC00Y2M5LWI2Y2EtODJkZTFjN2Y5ODlmXkEyXkFqcGc@._V1_SX300.jpg,"[{'Source': 'Internet Movie Database', 'Value': '6.3/10'}, {'Source': 'Rotten Tomatoes', 'Value': '63%'}, {'Source': 'Metacritic', 'Value': '59/100'}]",59,6.3,"681,027",tt0413300,movie,N/A,"$337,281,992",N/A,N/A,
23,"Nov 9, 2022",Black Panther: Wakanda Forever,"$250,000,000","$453,829,060","$859,208,836",True,,Black Panther: Wakanda Forever,2022,PG-13,11 Nov 2022,161 min,"Action, Adventure, Drama",Ryan Coogler,"Ryan Coogler, Joe Robert Cole, Stan Lee","Letitia Wright, Lupita Nyong'o, Danai Gurira",The people of Wakanda fight to protect their home from intervening world powers as they mourn the death of King T'Challa.,"English, Xhosa, Maya, Spanish, Haitian, French",United States,Won 1 Oscar. 50 wins & 171 nominations total,https://m.media-amazon.com/images/M/MV5BYWY5NDY1ZjItZDQxMy00MTAzLTgyOGQtNTQxYjFiMzZjMjUyXkEyXkFqcGc@._V1_SX300.jpg,"[{'Source': 'Internet Movie Database', 'Value': '6.6/10'}, {'Source': 'Rotten Tomatoes', 'Value': '84%'}, {'Source': 'Metacritic', 'Value': '67/100'}]",67,6.6,"341,017",tt9114286,movie,N/A,"$453,829,060",N/A,N/A,
24,"Apr 22, 2016",Captain America: Civil War,"$250,000,000","$408,084,349","$1,151,899,586",True,,Captain America: Civil War,2016,PG-13,06 May 2016,147 min,"Action, Sci-Fi","Anthony Russo, Joe Russo","Christopher Markus, Stephen McFeely, Joe Simon","Chris Evans, Robert Downey Jr., Scarlett Johansson",Political involvement in the Avengers' affairs causes a rift between Captain America and Iron Man.,"English, German, Xhosa, Russian, Romanian","United States, Germany, Iceland, United Kingdom",16 wins & 73 nominations total,https://m.media-amazon.com/images/M/MV5BMjQ0MTgyNjAxMV5BMl5BanBnXkFtZTgwNjUzMDkyODE@._V1_SX300.jpg,"[{'Source': 'Internet Movie Database', 'Value': '7.8/10'}, {'Source': 'Rotten Tomatoes', 'Value': '90%'}, {'Source': 'Metacritic', 'Value': '75/100'}]",75,7.8,"904,347",tt3498820,movie,N/A,"$408,084,349",N/A,N/A,
25,"May 3, 2023",Guardians of the Galaxy Vol 3,"$250,000,000","$358,995,815","$845,555,777",True,,Guardians of the Galaxy Vol. 3,2023,PG-13,05 May 2023,150 min,"Action, Adventure, Comedy",James Gunn,"James Gunn, Jim Starlin, Stan Lee","Chris Pratt, Chukwudi Iwuji, Bradley Cooper","Still reeling from the loss of Gamora, Peter Quill rallies his team to defend the universe and one of their own - a mission that could mean the end of the Guardians if not successful.","English, Russian","United States, New Zealand, France, Canada",Nominated for 1 Oscar. 12 wins & 93 nominations total,https://m.media-amazon.com/images/M/MV5BOTJhOTMxMmItZmE0Ny00MDc3LWEzOGEtOGFkMzY4MWYyZDQ0XkEyXkFqcGc@._V1_SX300.jpg,"[{'Source': 'Internet Movie Database', 'Value': '7.9/10'}, {'Source': 'Rotten Tomatoes', 'Value': '82%'}, {'Source': 'Metacritic', 'Value': '64/100'}]",64,7.9,"450,124",tt6791350,movie,N/A,"$358,995,815",N/A,N/A,
26,"Jul 1, 2022",Thor: Love and Thunder,"$250,000,000","$343,256,830","$760,928,081",True,,Thor: Love and Thunder,2022,PG-13,08 Jul 2022,118 min,"Action, Adventure, Comedy",Taika Waititi,"Taika Waititi, Jennifer Kaytin Robinson, Stan Lee","Chris Hemsworth, Natalie Portman, Christian Bale","Thor enlists the help of Valkyrie, Korg and ex-girlfriend Jane Foster to fight Gorr the God Butcher, who intends to make the gods extinct.",English,"Australia, United States",4 wins & 21 nominations total,https://m.media-amazon.com/images/M/MV5BZjRiMDhiZjQtNjk5Yi00ZDcwLTkyYTEtMDc1NjdmNjFhNGIzXkEyXkFqcGc@._V1_SX300.jpg,"[{'Source': 'Internet Movie Database', 'Value': '6.1/10'}, {'Source': 'Rotten Tomatoes', 'Value': '63%'}, {'Source': 'Metacritic', 'Value': '57/100'}]",57,6.1,"443,961",tt10648342,movie,N/A,"$343,256,830",N/A,N/A,
27,"Jul 15, 2009",Harry Potter and the Half-Blood Prince,"$250,000,000","$302,854,063","$926,055,796",True,,Harry Potter and the Half-Blood Prince,2009,PG,15 Jul 2009,153 min,"Action, Adventure, Family",David Yates,"Steve Kloves, J.K. Rowling","Daniel Radcliffe, Emma Watson, Rupert Grint","As Harry Potter begins his sixth year at Hogwarts, he discovers an old book marked as ""the property of the Half-Blood Prince"" and begins to learn more about Lord Voldemort's dark past.","English, Latin","United Kingdom, United States",Nominated for 1 Oscar. 9 wins & 39 nominations total,https://m.media-amazon.com/images/M/MV5BNzU3NDg4NTAyNV5BMl5BanBnXkFtZTcwOTg2ODg1Mg@@._V1_SX300.jpg,"[{'Source': 'Internet Movie Database', 'Value': '7.6/10'}, {'Source': 'Rotten Tomatoes', 'Value': '83%'}, {'Source': 'Metacritic', 'Value': '78/100'}]",78,7.6,"640,319",tt0417741,movie,N/A,"$302,334,374",N/A,N/A,
28,"May 24, 2023",The Little Mermaid,"$250,000,000","$298,172,056","$569,626,289",True,,The Little Mermaid,1989,G,17 Nov 1989,83 min,"Animation, Adventure, Family","Ron Clements, John Musker","John Musker, Ron Clements, Hans Christian Andersen","Jodi Benson, Samuel E. Wright, Rene Auberjonois",A mermaid princess makes a Faustian bargain in an attempt to become human and win a prince's love.,"English, French",United States,Won 2 Oscars. 16 wins & 9 nominations total,https://m.media-amazon.com/images/M/MV5BNmQ3ODcyZGMtMjNlOS00YzhlLTg0YzAtZGVjNmQ0OTYyNDg0XkEyXkFqcGc@._V1_SX300.jpg,"[{'Source': 'Internet Movie Database', 'Value': '7.6/10'}, {'Source': 'Rotten Tomatoes', 'Value': '92%'}, {'Source': 'Metacritic', 'Value': '88/100'}]",88,7.6,"303,917",tt0097757,movie,N/A,"$111,543,479",N/A,N/A,
29,"Dec 12, 2013",The Hobbit: The Desolation of Smaug,"$250,000,000","$258,241,522","$959,358,436",True,,The Hobbit: The Desolation of Smaug,2013,PG-13,13 Dec 2013,161 min,"Adventure, Fantasy",Peter Jackson,"Fran Walsh, Philippa Boyens, Peter Jackson","Ian McKellen, Martin Freeman, Richard Armitage","The dwarves, along with Bilbo Baggins and Gandalf the Grey, continue their quest to reclaim the Lonely Mountain, their homeland, from the dragon Smaug.",English,"New Zealand, United States",Nominated for 3 Oscars. 19 wins & 90 nominations total,https://m.media-amazon.com/images/M/MV5BMzU0NDY0NDEzNV5BMl5BanBnXkFtZTgwOTIxNDU1MDE@._V1_SX300.jpg,"[{'Source': 'Internet Movie Database', 'Value': '7.8/10'}, {'Source': 'Rotten Tomatoes', 'Value': '74%'}, {'Source': 'Metacritic', 'Value': '66/100'}]",66,7.8,"739,754",tt1170358,movie,N/A,"$258,387,334",N/A,N/A,
30,"Dec 10, 2014",The Hobbit: The Battle of the Five Armies,"$250,000,000","$255,119,788","$940,323,039",True,,The Hobbit: The Battle of the Five Armies,2014,R,17 Dec 2014,144 min,"Adventure, Fantasy",Peter Jackson,"Fran Walsh, Philippa Boyens, Peter Jackson","Ian McKellen, Martin Freeman, Richard Armitage",Bilbo Baggins and company are forced to engage in a war against an array of combatants and keep the Lonely Mountain from falling into the hands of a rising darkness.,English,"New Zealand, United States",Nominated for 1 Oscar. 8 wins & 56 nominations total,https://m.media-amazon.com/images/M/MV5BMTYzNDE3OTQ3MF5BMl5BanBnXkFtZTgwODczMTg4MjE@._V1_SX300.jpg,"[{'Source': 'Internet Movie Database', 'Value': '7.4/10'}, {'Source': 'Rotten Tomatoes', 'Value': '59%'}, {'Source': 'Metacritic', 'Value': '59/100'}]",59,7.4,"603,148",tt2310332,movie,N/A,"$255,138,261",N/A,N/A,
