index,Release Date,Title_x,Production Budget,Domestic Gross,Worldwide Gross,Response,Error,Title_y,Year,Rated,Released,Runtime,Genre,Director,Writer,Actors,Plot,Language,Country,Awards,Poster,Ratings,Metascore,imdbRating,imdbVotes,imdbID,Type,DVD,BoxOffice,Production,Website,totalSeasons
246,"Jun 15, 2005",Batman Begins,"$150,000,000","$205,343,774","$356,770,593",True,,Batman Begins,2005,PG-13,15 Jun 2005,140 min,"Action, Crime, Drama",Christopher Nolan,"Bob Kane, David S. Goyer, Christopher Nolan","Christian Bale, Michael Caine, Ken Watanabe","After witnessing his parents' death, billionaire Bruce Wayne learns the art of fighting to confront injustice. When he returns to Gotham as Batman, he must stop a secret society that intends to destroy the city.","English, Mandarin","United States, United Kingdom",Nominated for 1 Oscar. 15 wins & 79 nominations total,https://m.media-amazon.com/images/M/MV5BODIyMDdhNTgtNDlmOC00MjUxLWE2NDItODA5MTdkNzY3ZTdhXkEyXkFqcGc@._V1_SX300.jpg,"[{'Source': 'Internet Movie Database', 'Value': '8.2/10'}, {'Source': 'Rotten Tomatoes', 'Value': '85%'}, {'Source': 'Metacritic', 'Value': '70/100'}]",70,8.2,"1,673,263",tt0372784,movie,N/A,"$206,863,479",N/A,N/A,
247,"Jul 29, 2015",Mission: Impossible—Rogue Nation,"$150,000,000","$195,042,377","$688,858,992",True,,Mission: Impossible - Rogue Nation,2015,PG-13,31 Jul 2015,131 min,"Action, Adventure, Thriller",Christopher McQuarrie,"Bruce Geller, Christopher McQuarrie, Drew Pearce","Tom Cruise, Rebecca Ferguson, Jeremy Renner",Ethan and his team take on their most impossible mission yet when they have to eradicate an international rogue organization as highly skilled as they are and committed to destroying the IMF.,"English, Swedish, German, Russian","United States, China, United Kingdom, Austria, Morocco, Hong Kong",6 wins & 26 nominations total,https://m.media-amazon.com/images/M/MV5BZjUwZjg2ZjAtY2RhZi00YmZjLTlhNGQtOWQwNDk1MjhhM2NhXkEyXkFqcGc@._V1_SX300.jpg,"[{'Source': 'Internet Movie Database', 'Value': '7.4/10'}, {'Source': 'Rotten Tomatoes', 'Value': '94%'}, {'Source': 'Metacritic', 'Value': '75/100'}]",75,7.4,"437,807",tt2381249,movie,N/A,"$195,042,377",N/A,N/A,
248,"Jul 18, 2017",Dunkirk,"$150,000,000","$190,068,280","$528,068,280",True,,Dunkirk,2017,PG-13,21 Jul 2017,106 min,"Action, Drama, History",Christopher Nolan,Christopher Nolan,"Fionn Whitehead, Barry Keoghan, Mark Rylance","Allied soldiers from Belgium, the British Commonwealth and Empire, and France are surrounded by the German Army and evacuated during a fierce battle in World War II.","English, French, German","United Kingdom, Netherlands, France, United States",Won 3 Oscars. 68 wins & 236 nominations total,https://m.media-amazon.com/images/M/MV5BZWU5ZjJkNTQtMzQwOS00ZGE4LWJkMWUtMGQ5YjdiM2FhYmRhXkEyXkFqcGc@._V1_SX300.jpg,"[{'Source': 'Internet Movie Database', 'Value': '7.8/10'}, {'Source': 'Rotten Tomatoes', 'Value': '92%'}, {'Source': 'Metacritic', 'Value': '94/100'}]",94,7.8,"788,177",tt5013056,movie,N/A,"$189,740,665",N/A,N/A,
249,"Apr 29, 2011",Thor,"$150,000,000","$181,030,624","$449,326,618",True,,Thor,2011,PG-13,06 May 2011,115 min,"Action, Fantasy",Kenneth Branagh,"Ashley E. Miller, Zack Stentz, Don Payne","Chris Hemsworth, Anthony Hopkins, Natalie Portman","The powerful but arrogant god Thor is cast out of Asgard to live amongst humans in Midgard (Earth), where he soon becomes one of their finest defenders.",English,"United States, France",5 wins & 30 nominations total,https://m.media-amazon.com/images/M/MV5BNjRhNGZjZjEtYTQzYS00OWUxLThjNGEtMTIwMTE2ZDFlZTZkXkEyXkFqcGc@._V1_SX300.jpg,"[{'Source': 'Internet Movie Database', 'Value': '7.0/10'}, {'Source': 'Rotten Tomatoes', 'Value': '77%'}, {'Source': 'Metacritic', 'Value': '57/100'}]",57,7.0,"944,817",tt0800369,movie,N/A,"$181,030,624",N/A,N/A,
250,"Nov 7, 2008",Madagascar: Escape 2 Africa,"$150,000,000","$180,174,880","$599,680,774",True,,Madagascar: Escape 2 Africa,2008,PG,07 Nov 2008,89 min,"Animation, Adventure, Comedy","Eric Darnell, Tom McGrath","Etan Cohen, Eric Darnell, Tom McGrath","Ben Stiller, Chris Rock, David Schwimmer","The Madagascar animals fly back to New York City, but crash-land on an African nature reserve in Kenya, where they meet others of their own kind, and Alex especially discovers his royal heritage as prince of a lion pride.",English,"United States, United Kingdom",4 wins & 11 nominations total,https://m.media-amazon.com/images/M/MV5BMjExMDA4NDcwMl5BMl5BanBnXkFtZTcwODAxNTQ3MQ@@._V1_SX300.jpg,"[{'Source': 'Internet Movie Database', 'Value': '6.6/10'}, {'Source': 'Rotten Tomatoes', 'Value': '64%'}, {'Source': 'Metacritic', 'Value': '61/100'}]",61,6.6,"261,941",tt0479952,movie,N/A,"$180,010,950",N/A,N/A,
251,"May 1, 2009",X-Men Origins: Wolverine,"$150,000,000","$179,883,157","$374,825,760",True,,X-Men Origins: Wolverine,2009,PG-13,01 May 2009,107 min,"Action, Sci-Fi",Gavin Hood,"David Benioff, Skip Woods","Hugh Jackman, Liev Schreiber, Ryan Reynolds","The early years of James Logan, featuring his rivalry with his brother Victor Creed, his service in the special forces team Weapon X, and his experimentation into the metal-lined mutant Wolverine.",English,"United States, United Kingdom",3 wins & 21 nominations total,https://m.media-amazon.com/images/M/MV5BZjQwOGEzNjUtNDgwYS00NzUzLWJhZjAtNmFlNzY2YTQyOTllXkEyXkFqcGc@._V1_SX300.jpg,"[{'Source': 'Internet Movie Database', 'Value': '6.5/10'}, {'Source': 'Rotten Tomatoes', 'Value': '37%'}, {'Source': 'Metacritic', 'Value': '40/100'}]",40,6.5,"559,811",tt0458525,movie,N/A,"$179,883,157",N/A,N/A,
252,"May 22, 2009",Night at the Museum: Battle of the Smithsonian,"$150,000,000","$177,243,721","$402,231,063",True,,Night at the Museum: Battle of the Smithsonian,2009,PG,22 May 2009,105 min,"Adventure, Comedy, Family",Shawn Levy,"Robert Ben Garant, Thomas Lennon","Ben Stiller, Owen Wilson, Amy Adams","Security guard Larry Daley infiltrates the Smithsonian Institution in order to rescue Jedediah and Octavius, who have been shipped to the museum by mistake.",English,"United States, Canada",2 wins & 9 nominations total,https://m.media-amazon.com/images/M/MV5BY2E0NTRjMDEtMWI3NS00YTRmLTg4NmEtNzIxZjQ3YWM2NDQxXkEyXkFqcGc@._V1_SX300.jpg,"[{'Source': 'Internet Movie Database', 'Value': '6.0/10'}, {'Source': 'Rotten Tomatoes', 'Value': '43%'}, {'Source': 'Metacritic', 'Value': '42/100'}]",42,6.0,"222,946",tt1078912,movie,N/A,"$177,243,721",N/A,N/A,
253,"May 26, 2011",Kung Fu Panda 2,"$150,000,000","$165,249,063","$664,837,547",True,,Kung Fu Panda 2,2011,PG,26 May 2011,90 min,"Animation, Action, Adventure",Jennifer Yuh Nelson,"Jonathan Aibel, Glenn Berger, Ethan Reiff","Jack Black, Angelina Jolie, Jackie Chan","Po and his friends fight to stop a peacock villain from conquering China with a deadly new weapon, but first the Dragon Warrior must come to terms with his past.",English,United States,Nominated for 1 Oscar. 5 wins & 47 nominations total,https://m.media-amazon.com/images/M/MV5BYmIxMGYzMTUtZDQzYy00ODc4LWE1YzQtZGMwYTc0YTYyYTE0XkEyXkFqcGc@._V1_SX300.jpg,"[{'Source': 'Internet Movie Database', 'Value': '7.3/10'}, {'Source': 'Rotten Tomatoes', 'Value': '82%'}, {'Source': 'Metacritic', 'Value': '67/100'}]",67,7.3,"346,425",tt1302011,movie,N/A,"$165,249,063",N/A,N/A,
254,"May 14, 2015",Mad Max: Fury Road,"$150,000,000","$154,363,726","$380,463,726",True,,Mad Max: Fury Road,2015,R,15 May 2015,120 min,"Action, Adventure, Sci-Fi",George Miller,"George Miller, Brendan McCarthy, Nick Lathouris","Tom Hardy, Charlize Theron, Nicholas Hoult","In a post-apocalyptic wasteland, a woman rebels against a tyrannical ruler in search for her homeland with the aid of a group of female prisoners, a psychotic worshipper and a drifter named Max.","English, Russian","Australia, United States",Won 6 Oscars. 245 wins & 234 nominations total,https://m.media-amazon.com/images/M/MV5BZDRkODJhOTgtOTc1OC00NTgzLTk4NjItNDgxZDY4YjlmNDY2XkEyXkFqcGc@._V1_SX300.jpg,"[{'Source': 'Internet Movie Database', 'Value': '8.1/10'}, {'Source': 'Rotten Tomatoes', 'Value': '97%'}, {'Source': 'Metacritic', 'Value': '90/100'}]",90,8.1,"1,183,848",tt1392190,movie,N/A,"$154,280,290",N/A,N/A,
255,"May 3, 2019",Pokémon: Detective Pikachu,"$150,000,000","$144,105,346","$433,088,346",True,,Pokémon: Detective Pikachu,2019,PG,10 May 2019,104 min,"Adventure, Comedy, Family",Rob Letterman,"Dan Hernandez, Benji Samit, Rob Letterman","Ryan Reynolds, Justice Smith, Kathryn Newton","In a world where people collect Pokémon to do battle, a boy comes across an intelligent talking Pikachu who seeks to be a detective.","English, Japanese","United States, Japan, United Kingdom, Canada",9 nominations total,https://m.media-amazon.com/images/M/MV5BNDU4Mzc3NzE5NV5BMl5BanBnXkFtZTgwMzE1NzI1NzM@._V1_SX300.jpg,"[{'Source': 'Internet Movie Database', 'Value': '6.5/10'}, {'Source': 'Rotten Tomatoes', 'Value': '68%'}, {'Source': 'Metacritic', 'Value': '53/100'}]",53,6.5,"192,442",tt5884052,movie,N/A,"$144,174,568",N/A,N/A,
256,"Nov 5, 2003",The Matrix Revolutions,"$150,000,000","$139,270,910","$427,300,260",True,,The Matrix Revolutions,2003,R,05 Nov 2003,129 min,"Action, Sci-Fi","Lana Wachowski, Lilly Wachowski","Lilly Wachowski, Lana Wachowski","Keanu Reeves, Laurence Fishburne, Carrie-Anne Moss",The human city of Zion defends itself against the massive invasion of the machines as Neo fights to end the war at another front while also opposing the rogue Agent Smith.,"English, French","United States, Australia",5 wins & 36 nominations total,https://m.media-amazon.com/images/M/MV5BMmNmMTEzODQtNmExMS00OGUxLWFkNTItMTM3NzBlNDk0YWU5XkEyXkFqcGc@._V1_SX300.jpg,"[{'Source': 'Internet Movie Database', 'Value': '6.7/10'}, {'Source': 'Rotten Tomatoes', 'Value': '33%'}, {'Source': 'Metacritic', 'Value': '47/100'}]",47,6.7,"566,996",tt0242653,movie,N/A,"$139,313,948",N/A,N/A,
257,"Mar 20, 2018",Ready Player One,"$150,000,000","$137,690,172","$583,490,172",True,,Ready Player One,2018,PG-13,29 Mar 2018,140 min,"Action, Adventure, Sci-Fi",Steven Spielberg,"Zak Penn, Ernest Cline","Tye Sheridan, Olivia Cooke, Ben Mendelsohn","When the creator of a virtual reality called the OASIS dies, he makes a posthumous challenge to all OASIS users to find his Easter Egg, which will give the finder his fortune and control of his world.","English, Japanese","United States, India, Singapore, Canada, United Kingdom, Japan, Australia",Nominated for 1 Oscar. 11 wins & 58 nominations total,https://m.media-amazon.com/images/M/MV5BNzVkMTgzODQtMWIwZC00NzE4LTgzZjYtMzAwM2I5OGZhNjE4XkEyXkFqcGc@._V1_SX300.jpg,"[{'Source': 'Internet Movie Database', 'Value': '7.4/10'}, {'Source': 'Rotten Tomatoes', 'Value': '71%'}, {'Source': 'Metacritic', 'Value': '64/100'}]",64,7.4,"527,706",tt1677720,movie,N/A,"$137,715,350",N/A,N/A,
258,"Nov 4, 2005",Chicken Little,"$150,000,000","$135,386,665","$310,043,823",True,,Chicken Little,2005,G,04 Nov 2005,81 min,"Animation, Adventure, Comedy",Mark Dindal,"Mark Dindal, Mark Kennedy, Steve Bencich","Zach Braff, Joan Cusack, Garry Marshall","After ruining his reputation with the town, a courageous chicken must come to the rescue of his fellow citizens when aliens start an invasion.",English,United States,4 wins & 15 nominations total,https://m.media-amazon.com/images/M/MV5BMTM3MTIzMDQxMV5BMl5BanBnXkFtZTYwNTE0Mjg3._V1_SX300.jpg,"[{'Source': 'Internet Movie Database', 'Value': '5.7/10'}, {'Source': 'Rotten Tomatoes', 'Value': '36%'}, {'Source': 'Metacritic', 'Value': '48/100'}]",48,5.7,"106,831",tt0371606,movie,N/A,"$135,386,665",N/A,N/A,
259,"May 5, 2006",Mission: Impossible III,"$150,000,000","$133,501,348","$399,387,745",True,,Mission: Impossible III,2006,PG-13,05 May 2006,126 min,"Action, Adventure, Thriller",J.J. Abrams,"Alex Kurtzman, Roberto Orci, J.J. Abrams","Tom Cruise, Michelle Monaghan, Ving Rhames",IMF agent Ethan Hunt comes into conflict with a dangerous and sadistic arms dealer who threatens his life and his fiancée in response.,"English, Italian, Mandarin, Cantonese, German, Czech","Italy, Germany, China, United States",7 wins & 14 nominations total,https://m.media-amazon.com/images/M/MV5BNzY1MzdjMjYtNDJiZS00N2U4LWI0MWQtZTRiZWYxMzU3ZmI4XkEyXkFqcGc@._V1_SX300.jpg,"[{'Source': 'Internet Movie Database', 'Value': '6.9/10'}, {'Source': 'Rotten Tomatoes', 'Value': '73%'}, {'Source': 'Metacritic', 'Value': '66/100'}]",66,6.9,"417,535",tt0317919,movie,N/A,"$134,029,801",N/A,N/A,
260,"May 15, 2009",Angels & Demons,"$150,000,000","$133,375,846","$490,875,846",True,,Angels & Demons,2009,PG-13,15 May 2009,138 min,"Mystery, Thriller",Ron Howard,"David Koepp, Akiva Goldsman, Dan Brown","Tom Hanks, Ewan McGregor, Ayelet Zurer",Harvard symbologist Robert Langdon works with a nuclear physicist to solve a murder and prevent a terrorist act against the Vatican during one of the significant events within the church.,"English, Italian, Latin, French, Swiss German, German, Chinese, Spanish, Polish","United States, Italy",1 win & 5 nominations total,https://m.media-amazon.com/images/M/MV5BMjEzNzM2MjgxMF5BMl5BanBnXkFtZTcwNTQ1MTM0Mg@@._V1_SX300.jpg,"[{'Source': 'Internet Movie Database', 'Value': '6.7/10'}, {'Source': 'Rotten Tomatoes', 'Value': '36%'}, {'Source': 'Metacritic', 'Value': '48/100'}]",48,6.7,"319,918",tt0808151,movie,N/A,"$133,375,846",N/A,N/A,
261,"May 13, 2004",Troy,"$150,000,000","$133,298,577","$483,152,040",True,,Troy,2004,R,14 May 2004,163 min,"Action, Adventure, Drama",Wolfgang Petersen,"Homer, David Benioff","Brad Pitt, Eric Bana, Orlando Bloom","An adaptation of Homer's great epic, the film follows the assault on Troy by the united Greek forces.",English,"United States, Bulgaria, United Kingdom, Malta",Nominated for 1 Oscar. 5 wins & 23 nominations total,https://m.media-amazon.com/images/M/MV5BMTk5MzU1MDMwMF5BMl5BanBnXkFtZTcwNjczODMzMw@@._V1_SX300.jpg,"[{'Source': 'Internet Movie Database', 'Value': '7.3/10'}, {'Source': 'Rotten Tomatoes', 'Value': '53%'}, {'Source': 'Metacritic', 'Value': '56/100'}]",56,7.3,"601,146",tt0332452,movie,N/A,"$133,378,256",N/A,N/A,
262,"Jul 1, 2010",The Last Airbender,"$150,000,000","$131,772,187","$319,713,881",True,,The Last Airbender,2010,PG,01 Jul 2010,103 min,"Action, Adventure, Family",M. Night Shyamalan,M. Night Shyamalan,"Noah Ringer, Nicola Peltz Beckham, Jackson Rathbone","Aang, a young successor to a long line of Avatars, must master all four elements and stop the Fire Nation from enslaving the Water Tribes and the Earth Kingdom.",English,"United States, Vietnam, United Kingdom, Canada, Denmark",8 wins & 12 nominations total,https://m.media-amazon.com/images/M/MV5BOGEwNDlmZDQtMjA0My00NWMwLWJkNTAtODk2MGVjODBlNWFjXkEyXkFqcGc@._V1_SX300.jpg,"[{'Source': 'Internet Movie Database', 'Value': '4.0/10'}, {'Source': 'Rotten Tomatoes', 'Value': '5%'}, {'Source': 'Metacritic', 'Value': '20/100'}]",20,4.0,"179,669",tt0938283,movie,N/A,"$131,772,187",N/A,N/A,
263,"Nov 2, 2007",Bee Movie,"$150,000,000","$126,631,277","$287,594,577",True,,Bee Movie,2007,PG,02 Nov 2007,91 min,"Animation, Adventure, Comedy","Simon J. Smith, Steve Hickner","Jerry Seinfeld, Spike Feresten, Barry Marder","Jerry Seinfeld, Renée Zellweger, Matthew Broderick","Barry B. Benson, a bee just graduated from college, is disillusioned at his lone career choice: making honey. On a special trip outside the hive, Barry's life is saved by Vanessa, a florist in New York City. As their relationship ...",English,"United States, Canada",1 win & 15 nominations total,https://m.media-amazon.com/images/M/MV5BMjE1MDYxOTA4MF5BMl5BanBnXkFtZTcwMDE0MDUzMw@@._V1_SX300.jpg,"[{'Source': 'Internet Movie Database', 'Value': '6.1/10'}, {'Source': 'Rotten Tomatoes', 'Value': '49%'}, {'Source': 'Metacritic', 'Value': '54/100'}]",54,6.1,"191,705",tt0389790,movie,N/A,"$126,631,277",N/A,N/A,
264,"Jul 24, 2009",G-Force,"$150,000,000","$119,436,770","$292,817,841",True,,G-Force,2009,PG,24 Jul 2009,88 min,"Animation, Action, Adventure",Hoyt Yeatman,"Cormac Wibberley, Marianne Wibberley, Hoyt Yeatman","Will Arnett, Penélope Cruz, Zach Galifianakis",A specially trained squad of guinea pigs is dispatched to stop a diabolical billionaire from taking over the world.,"English, Spanish",United States,1 win & 1 nomination total,https://m.media-amazon.com/images/M/MV5BMTM4NTY3MzY2MV5BMl5BanBnXkFtZTcwMDQ1NTM2Mg@@._V1_SX300.jpg,"[{'Source': 'Internet Movie Database', 'Value': '5.1/10'}, {'Source': 'Rotten Tomatoes', 'Value': '22%'}, {'Source': 'Metacritic', 'Value': '41/100'}]",41,5.1,"51,874",tt0436339,movie,N/A,"$119,436,770",N/A,N/A,
265,"Nov 21, 2008",Bolt,"$150,000,000","$114,053,579","$328,015,029",True,,Bolt,2008,PG,21 Nov 2008,96 min,"Animation, Adventure, Comedy","Byron Howard, Chris Williams","Dan Fogelman, Chris Williams","John Travolta, Miley Cyrus, Susie Essman",The canine star of a fictional sci-fi/action show that believes his powers are real embarks on a cross country trek to save his co-star from a threat he believes is just as real.,English,"United States, Japan",Nominated for 1 Oscar. 1 win & 32 nominations total,https://m.media-amazon.com/images/M/MV5BMTY3NGVkMmItYWNjMy00MmE0LTlkZmUtNGIxZGJmZTA1YWI0XkEyXkFqcGc@._V1_SX300.jpg,"[{'Source': 'Internet Movie Database', 'Value': '6.8/10'}, {'Source': 'Rotten Tomatoes', 'Value': '90%'}, {'Source': 'Metacritic', 'Value': '67/100'}]",67,6.8,"241,714",tt0397892,movie,N/A,"$114,053,579",N/A,N/A,
266,"Nov 24, 2021",Encanto,"$150,000,000","$96,093,622","$230,815,162",True,,Encanto,2021,PG,24 Nov 2021,102 min,"Animation, Comedy, Family","Jared Bush, Byron Howard, Charise Castro Smith","Charise Castro Smith, Jared Bush, Byron Howard","Stephanie Beatriz, María Cecilia Botero, John Leguizamo","An extraordinary family, the Madrigals, live hidden in the mountains of Colombia, in a magical house called an Encanto. The magic of the Encanto has blessed every child in the family with a unique gift - every child except one, Mi...","English, Spanish",United States,Won 1 Oscar. 58 wins & 86 nominations total,https://m.media-amazon.com/images/M/MV5BNGEyNzk2M2MtNjBhZS00MzYwLWI0Y2YtYjc5ZWE2MjM0YWE5XkEyXkFqcGc@._V1_SX300.jpg,"[{'Source': 'Internet Movie Database', 'Value': '7.2/10'}, {'Source': 'Metacritic', 'Value': '75/100'}]",75,7.2,"286,569",tt2953050,movie,N/A,"$96,093,622",Disney,N/A,
267,"Mar 2, 2023",Dungeons & Dragons: Honor Among Thieves,"$150,000,000","$93,549,650","$207,854,947",True,,Dungeons & Dragons: Honor Among Thieves,2023,PG-13,31 Mar 2023,134 min,"Action, Adventure, Comedy","John Francis Daley, Jonathan Goldstein","Jonathan Goldstein, John Francis Daley, Michael Gilio","Chris Pine, Michelle Rodriguez, Regé-Jean Page","A charming thief and a band of unlikely adventurers embark on an epic quest to retrieve a lost relic, but things go dangerously awry when they run afoul of the wrong people.",English,"United States, Canada, United Kingdom, Iceland, Ireland, Australia",4 wins & 21 nominations total,https://m.media-amazon.com/images/M/MV5BOGRjMjQ0ZDAtODc0OS00MGY1LTkxMTMtODhhNjY5NTM4N2IwXkEyXkFqcGc@._V1_SX300.jpg,"[{'Source': 'Internet Movie Database', 'Value': '7.2/10'}, {'Source': 'Metacritic', 'Value': '72/100'}]",72,7.2,"266,535",tt2906216,movie,N/A,"$93,549,650",Paramount Pictures,N/A,
268,"Mar 28, 2012",Wrath of the Titans,"$150,000,000","$83,670,083","$305,270,083",True,,Wrath of the Titans,2012,PG-13,30 Mar 2012,99 min,"Action, Adventure, Fantasy",Jonathan Liebesman,"Dan Mazeau, David Leslie Johnson-McGoldrick, Greg Berlanti","Sam Worthington, Liam Neeson, Rosamund Pike","Perseus braves the treacherous underworld to rescue his father, Zeus, captured by his son, Ares, and brother Hades who unleash the ancient Titans upon the world.",English,"United States, Spain",2 wins & 3 nominations total,https://m.media-amazon.com/images/M/MV5BMjMyMzk1Nzg3OF5BMl5BanBnXkFtZTcwOTQ2NjcxNw@@._V1_SX300.jpg,"[{'Source': 'Internet Movie Database', 'Value': '5.7/10'}, {'Source': 'Rotten Tomatoes', 'Value': '26%'}, {'Source': 'Metacritic', 'Value': '37/100'}]",37,5.7,"200,944",tt1646987,movie,N/A,"$83,670,083",N/A,N/A,
269,"Nov 16, 2007",Beowulf,"$150,000,000","$82,280,579","$195,080,579",True,,Beowulf,2007,PG-13,16 Nov 2007,115 min,"Animation, Action, Adventure",Robert Zemeckis,"Neil Gaiman, Roger Avary, Anonymous","Ray Winstone, Crispin Glover, Angelina Jolie","The warrior Beowulf must fight and defeat the monster Grendel, who is terrorizing Denmark, then Grendel's Mother, who begins killing out of revenge.","English, Old English",United States,4 wins & 19 nominations total,https://m.media-amazon.com/images/M/MV5BMTUzMjM0MTc3MF5BMl5BanBnXkFtZTcwNzU0ODMyMw@@._V1_SX300.jpg,"[{'Source': 'Internet Movie Database', 'Value': '6.3/10'}, {'Source': 'Rotten Tomatoes', 'Value': '71%'}, {'Source': 'Metacritic', 'Value': '59/100'}]",59,6.3,"178,418",tt0442933,movie,N/A,"$82,280,579",N/A,N/A,
270,"May 9, 2012",Dark Shadows,"$150,000,000","$79,727,149","$245,564,215",True,,Dark Shadows,2012,PG-13,11 May 2012,113 min,"Comedy, Fantasy, Horror",Tim Burton,"Seth Grahame-Smith, John August, Dan Curtis","Johnny Depp, Michelle Pfeiffer, Eva Green","An imprisoned vampire, Barnabas Collins, is set free and returns to his ancestral home, where his dysfunctional descendants are in need of his protection.",English,"United States, Australia, United Kingdom",3 wins & 12 nominations total,https://m.media-amazon.com/images/M/MV5BMjNiYWMxZjctMzEyZS00NDZmLTgxYmYtM2NmOGI0MmY3ZTJiXkEyXkFqcGc@._V1_SX300.jpg,"[{'Source': 'Internet Movie Database', 'Value': '6.2/10'}, {'Source': 'Rotten Tomatoes', 'Value': '35%'}, {'Source': 'Metacritic', 'Value': '55/100'}]",55,6.2,"291,083",tt1077368,movie,N/A,"$79,727,149",N/A,N/A,
271,"Jun 28, 2013",White House Down,"$150,000,000","$73,103,784","$205,440,387",True,,White House Down,2013,PG-13,28 Jun 2013,131 min,"Action, Drama, Thriller",Roland Emmerich,James Vanderbilt,"Channing Tatum, Jamie Foxx, Maggie Gyllenhaal","While on a tour of the White House with his young daughter, a Capitol policeman springs into action to save his child and protect the president from a heavily armed group of dangerous terrorists.",English,United States,3 wins & 9 nominations total,https://m.media-amazon.com/images/M/MV5BNTZkMmRiY2EtOTljZS00MjJjLWFiNDQtNjEwYWE0NWNkYjI4XkEyXkFqcGc@._V1_SX300.jpg,"[{'Source': 'Internet Movie Database', 'Value': '6.3/10'}, {'Source': 'Rotten Tomatoes', 'Value': '52%'}, {'Source': 'Metacritic', 'Value': '52/100'}]",52,6.3,"245,385",tt2334879,movie,N/A,"$73,103,784",N/A,N/A,
272,"Jun 13, 2025",Elio,"$150,000,000","$72,987,454","$154,103,081",True,,Elio,2025,PG,20 Jun 2025,98 min,"Animation, Adventure, Comedy","Adrian Molina, Madeline Sharafian, Domee Shi","Julia Cho, Mark Hammer, Mike Jones","Yonas Kibreab, Zoe Saldaña, Remy Edgerly","Elio, a space fanatic with an active imagination, finds himself on a cosmic misadventure where he must form new bonds with alien lifeforms, navigate a crisis of intergalactic proportions and somehow discover who he is truly meant ...",English,United States,2 nominations total,https://m.media-amazon.com/images/M/MV5BOWE5ZDMyMWEtOTZjMi00YzFhLWE4OTEtNDc3MDMzZjFmMmIzXkEyXkFqcGc@._V1_SX300.jpg,"[{'Source': 'Internet Movie Database', 'Value': '6.8/10'}, {'Source': 'Rotten Tomatoes', 'Value': '83%'}, {'Source': 'Metacritic', 'Value': '66/100'}]",66,6.8,"21,194",tt4900148,movie,N/A,"$72,987,454",N/A,N/A,
273,"Jul 14, 2021",Space Jam: A New Legacy,"$150,000,000","$70,592,228","$163,692,228",True,,Space Jam: A New Legacy,2021,PG,15 Jul 2021,115 min,"Animation, Adventure, Comedy",Malcolm D. Lee,"Leo Benvenuti, Steve Rudnick, Timothy Harris","LeBron James, Don Cheadle, Cedric Joe","A rogue artificial intelligence kidnaps the son of famed basketball player LeBron James, who then has to work with the Looney Tunes to win a basketball game.",English,"United States, United Kingdom, Singapore, Canada, Australia",7 wins & 6 nominations total,https://m.media-amazon.com/images/M/MV5BMDkyOGM4MDMtZWU4ZS00YWMxLTgzNjAtYzI4M2Y1ODA4YWJlXkEyXkFqcGc@._V1_SX300.jpg,"[{'Source': 'Internet Movie Database', 'Value': '4.5/10'}, {'Source': 'Rotten Tomatoes', 'Value': '25%'}, {'Source': 'Metacritic', 'Value': '36/100'}]",36,4.5,"84,532",tt3554046,movie,N/A,"$70,592,228",N/A,N/A,
274,"Jul 26, 2023",Haunted Mansion,"$150,000,000","$67,653,287","$117,449,790",True,,Haunted Mansion,2023,PG-13,28 Jul 2023,123 min,"Comedy, Drama, Family",Justin Simien,Katie Dippold,"LaKeith Stanfield, Rosario Dawson, Owen Wilson","A single mom named Gabbie hires a tour guide, a psychic, a priest and a historian to help exorcise her newly bought mansion after discovering it is inhabited by ghosts.","English, French, Spanish","United States, Canada",8 nominations total,https://m.media-amazon.com/images/M/MV5BZmQ5ZDY0NjYtNzdlNC00ZWI4LTkwZDItNjNiNTRhZjNmN2RiXkEyXkFqcGc@._V1_SX300.jpg,"[{'Source': 'Internet Movie Database', 'Value': '6.0/10'}, {'Source': 'Rotten Tomatoes', 'Value': '38%'}, {'Source': 'Metacritic', 'Value': '47/100'}]",47,6.0,"47,799",tt1695843,movie,N/A,"$67,653,287",N/A,N/A,
275,"Feb 12, 2010",The Wolfman,"$150,000,000","$62,189,884","$142,634,358",True,,The Wolfman,2010,R,12 Feb 2010,103 min,"Drama, Fantasy, Horror",Joe Johnston,"Andrew Kevin Walker, David Self, Curt Siodmak","Benicio Del Toro, Anthony Hopkins, Emily Blunt","Upon his return to his ancestral homeland, an American man is bitten and subsequently cursed by a werewolf.","English, Romany, Romanian, Ukrainian","Japan, United States",Won 1 Oscar. 4 wins & 9 nominations total,https://m.media-amazon.com/images/M/MV5BMTI4OTVlZGItNjAzNi00OTg2LWI4MTAtOTZhMDNhY2UwOGVhXkEyXkFqcGc@._V1_SX300.jpg,"[{'Source': 'Internet Movie Database', 'Value': '5.9/10'}, {'Source': 'Rotten Tomatoes', 'Value': '32%'}, {'Source': 'Metacritic', 'Value': '43/100'}]",43,5.9,"116,044",tt0780653,movie,N/A,"$61,979,680",N/A,N/A,
