index,Release Date,Title_x,Production Budget,Domestic Gross,Worldwide Gross,Response,Error,Title_y,Year,Rated,Released,Runtime,Genre,Director,Writer,Actors,Plot,Language,Country,Awards,Poster,Ratings,Metascore,imdbRating,imdbVotes,imdbID,Type,DVD,BoxOffice,Production,Website,totalSeasons
502,"Dec 25, 2013",The Wolf of Wall Street,"$100,000,000","$116,949,183","$389,816,136",True,,The Wolf of Wall Street,2013,R,25 Dec 2013,180 min,"Biography, Comedy, Crime",Martin Scorsese,"Terence Winter, Jordan Belfort","Leonardo DiCaprio, Jonah Hill, Margot Robbie","Based on the true story of Jordan Belfort, from his rise to a wealthy stock-broker living the high life to his fall involving crime, corruption and the federal government.","English, French",United States,Nominated for 5 Oscars. 38 wins & 180 nominations total,https://m.media-amazon.com/images/M/MV5BMjIxMjgxNTk0MF5BMl5BanBnXkFtZTgwNjIyOTg2MDE@._V1_SX300.jpg,"[{'Source': 'Internet Movie Database', 'Value': '8.2/10'}, {'Source': 'Rotten Tomatoes', 'Value': '79%'}, {'Source': 'Metacritic', 'Value': '75/100'}]",75,8.2,"1,722,525",tt0993846,movie,N/A,"$116,900,694",N/A,N/A,
503,"Mar 20, 2024",Ghostbusters: Frozen Empire,"$100,000,000","$113,376,590","$199,941,000",True,,Ghostbusters: Frozen Empire,2024,PG-13,22 Mar 2024,115 min,"Adventure, Comedy, Fantasy",Gil Kenan,"Gil Kenan, Jason Reitman, Ivan Reitman","Paul Rudd, Carrie Coon, Finn Wolfhard","When the discovery of an ancient artifact unleashes an evil force, Ghostbusters new and old must join forces to protect their home and save the world from a second ice age.","English, Korean, French","United States, Canada, United Kingdom",8 nominations total,https://m.media-amazon.com/images/M/MV5BNjcwMWQ4NTktODU5OC00NzBjLTg0Y2MtZTRjNDkzMjZmOTE4XkEyXkFqcGc@._V1_SX300.jpg,"[{'Source': 'Internet Movie Database', 'Value': '6.1/10'}, {'Source': 'Rotten Tomatoes', 'Value': '42%'}, {'Source': 'Metacritic', 'Value': '46/100'}]",46,6.1,"96,794",tt21235248,movie,N/A,"$113,376,590",N/A,N/A,
504,"May 24, 2013",Epic,"$100,000,000","$107,518,682","$262,794,441",True,,Epic,2013,PG,24 May 2013,102 min,"Animation, Action, Adventure",Chris Wedge,"James V. Hart, William Joyce, Daniel Shere","Amanda Seyfried, Josh Hutcherson, Beyoncé",A teenager finds herself transported to a deep forest setting where a battle between the forces of good and evil is taking place. She bands together with a ragtag group of characters to save their world--and ours.,English,"United States, United Kingdom",2 wins & 21 nominations total,https://m.media-amazon.com/images/M/MV5BYTJmMWJmZTktZmM2Zi00ZmE0LWJiYWMtMDRlNDdhMmVjNjA3XkEyXkFqcGc@._V1_SX300.jpg,"[{'Source': 'Internet Movie Database', 'Value': '6.6/10'}, {'Source': 'Rotten Tomatoes', 'Value': '65%'}, {'Source': 'Metacritic', 'Value': '52/100'}]",52,6.6,"113,253",tt0848537,movie,N/A,"$107,518,682",N/A,N/A,
505,"Jun 21, 1996",Eraser,"$100,000,000","$101,295,562","$234,400,000",True,,Eraser,1996,R,21 Jun 1996,115 min,"Action, Crime, Thriller",Chuck Russell,"Tony Puryear, Walon Green, Michael S. Chernuchin","Arnold Schwarzenegger, Vanessa Williams, James Caan",A Witness Protection specialist becomes suspicious of his co-workers when dealing with a case involving high-tech weapons.,"English, Russian",United States,Nominated for 1 Oscar. 3 wins & 2 nominations total,https://m.media-amazon.com/images/M/MV5BMmNkMjg3NWMtY2RhMC00MDRlLWI4MzktNjEzNGFjYTMwYjQ3XkEyXkFqcGc@._V1_SX300.jpg,"[{'Source': 'Internet Movie Database', 'Value': '6.2/10'}, {'Source': 'Rotten Tomatoes', 'Value': '43%'}, {'Source': 'Metacritic', 'Value': '56/100'}]",56,6.2,"122,562",tt0116213,movie,N/A,"$101,295,562",N/A,N/A,
506,"Jun 21, 1996",The Hunchback of Notre Dame,"$100,000,000","$100,138,851","$325,500,000",True,,The Hunchback of Notre Dame,1996,G,21 Jun 1996,91 min,"Animation, Drama, Family","Gary Trousdale, Kirk Wise","Tab Murphy, Victor Hugo, Irene Mecchi","Demi Moore, Jason Alexander, Mary Kay Bergman","A deformed bell-ringer must assert his independence from a vicious government minister in order to help his friend, a gypsy dancer.","English, Latin",United States,Nominated for 1 Oscar. 8 wins & 26 nominations total,https://m.media-amazon.com/images/M/MV5BY2QzMGEzNGMtMDQyNC00YTlmLWEwYjMtOGI1NWYxMTM4NjA2XkEyXkFqcGc@._V1_SX300.jpg,"[{'Source': 'Internet Movie Database', 'Value': '7.0/10'}, {'Source': 'Rotten Tomatoes', 'Value': '80%'}, {'Source': 'Metacritic', 'Value': '74/100'}]",74,7.0,"179,425",tt0116583,movie,N/A,"$100,138,851",N/A,N/A,
507,"Dec 15, 2000",The Emperor’s New Groove,"$100,000,000","$89,630,573","$169,630,573",True,,The Emperor's New Groove,2000,G,15 Dec 2000,78 min,"Animation, Adventure, Comedy",Mark Dindal,"Chris Williams, Mark Dindal, David Reynolds","David Spade, John Goodman, Eartha Kitt","Emperor Kuzco is turned into a llama by his ex-administrator Yzma, and must now regain his throne and his human form with the help of Pacha, a gentle llama herder.",English,"United States, Japan, France",Nominated for 1 Oscar. 7 wins & 27 nominations total,https://m.media-amazon.com/images/M/MV5BMjM2MWU5ZDEtNDZlZC00ZmQ2LThiOTEtMmZkMzAxMmI5MGIyXkEyXkFqcGc@._V1_SX300.jpg,"[{'Source': 'Internet Movie Database', 'Value': '7.4/10'}, {'Source': 'Rotten Tomatoes', 'Value': '86%'}, {'Source': 'Metacritic', 'Value': '70/100'}]",70,7.4,"242,173",tt0120917,movie,N/A,"$89,636,687",N/A,N/A,
508,"May 26, 2021",Cruella,"$100,000,000","$86,103,234","$225,810,063",True,,Cruella,2021,PG-13,28 May 2021,134 min,"Adventure, Comedy, Crime",Craig Gillespie,"Dana Fox, Tony McNamara, Aline Brosh McKenna","Emma Stone, Emma Thompson, Joel Fry","During the 1970s London punk rock revolution, young grifter Estella transforms herself into the raucous, revenge-bent Cruella de Vil.","English, French","United States, United Kingdom, Canada, Ireland",Won 1 Oscar. 28 wins & 43 nominations total,https://m.media-amazon.com/images/M/MV5BMWY5MjljNjctZjhjZS00MWY0LTgwYzUtZTJiYTVmMmJkM2E0XkEyXkFqcGc@._V1_SX300.jpg,"[{'Source': 'Internet Movie Database', 'Value': '7.3/10'}, {'Source': 'Rotten Tomatoes', 'Value': '75%'}, {'Source': 'Metacritic', 'Value': '59/100'}]",59,7.3,"286,888",tt3228774,movie,N/A,"$86,103,234",N/A,N/A,
509,"Aug 15, 2012",The Expendables 2,"$100,000,000","$85,028,192","$311,979,256",True,,The Expendables 2,2012,R,17 Aug 2012,103 min,"Action, Adventure, Thriller",Simon West,"Richard Wenk, Sylvester Stallone, Ken Kaufman","Sylvester Stallone, Liam Hemsworth, Randy Couture","Mr. Church reunites the Expendables for what should be an easy paycheck, but when one of their men is murdered on the job, their quest for revenge puts them deep in enemy territory and up against an unexpected threat.",English,"United States, Germany, China",4 wins & 5 nominations total,https://m.media-amazon.com/images/M/MV5BMTkwZGYyYzktNmEzMS00ZDkzLTlkMjEtYTdiOWExM2Y2ZjE4XkEyXkFqcGc@._V1_SX300.jpg,"[{'Source': 'Internet Movie Database', 'Value': '6.6/10'}, {'Source': 'Rotten Tomatoes', 'Value': '68%'}, {'Source': 'Metacritic', 'Value': '51/100'}]",51,6.6,"330,063",tt1764651,movie,N/A,"$85,028,192",N/A,N/A,
510,"Oct 16, 2009",Where the Wild Things Are,"$100,000,000","$77,233,467","$99,123,656",True,,Where the Wild Things Are,2009,PG,16 Oct 2009,101 min,"Adventure, Drama, Family",Spike Jonze,"Spike Jonze, Dave Eggers, Maurice Sendak","Max Records, Catherine O'Hara, Forest Whitaker","Yearning for escape and adventure, a young boy runs away from home and sails to an island filled with creatures that take him in as their king.",English,"Germany, United States, Australia",7 wins & 54 nominations total,https://m.media-amazon.com/images/M/MV5BNzQ1NzAwODEwM15BMl5BanBnXkFtZTcwNTE4MjI4Mg@@._V1_SX300.jpg,"[{'Source': 'Internet Movie Database', 'Value': '6.7/10'}, {'Source': 'Rotten Tomatoes', 'Value': '73%'}, {'Source': 'Metacritic', 'Value': '71/100'}]",71,6.7,"111,109",tt0386117,movie,N/A,"$77,233,467",N/A,N/A,
511,"Dec 15, 2006",Eragon,"$100,000,000","$75,030,163","$249,488,115",True,,Eragon,2006,PG,15 Dec 2006,104 min,"Action, Adventure, Family",Stefen Fangmeier,"Peter Buchman, Christopher Paolini","Ed Speleers, Sienna Guillory, Jeremy Irons","In his homeland of Alagaesia, a farm boy happens upon a dragon's egg -- a discovery that leads him on a predestined journey where he realizes he's the one person who can defend his home against an evil king.",English,"United Kingdom, Hungary, United States",1 win & 6 nominations total,https://m.media-amazon.com/images/M/MV5BOWY3YWEzYzYtYjY4MC00ODA5LTliMTAtNWUxNTI4YWRhMjIxXkEyXkFqcGc@._V1_SX300.jpg,"[{'Source': 'Internet Movie Database', 'Value': '5.1/10'}, {'Source': 'Metacritic', 'Value': '38/100'}]",38,5.1,"133,339",tt0449010,movie,N/A,"$75,030,163",N/A,N/A,
512,"Jul 23, 2014",Hercules,"$100,000,000","$72,688,614","$243,388,614",True,,Hercules,1997,G,27 Jun 1997,93 min,"Animation, Action, Adventure","Ron Clements, John Musker","Ron Clements, John Musker, Don McEnery","Tate Donovan, Susan Egan, James Woods",The son of Zeus and Hera is stripped of his immortality as an infant and must become a true hero in order to reclaim it.,"English, Spanish, Greek",United States,Nominated for 1 Oscar. 9 wins & 16 nominations total,https://m.media-amazon.com/images/M/MV5BMmUyZGY1ZjItMWYwZS00MjJjLTg1YzAtY2Q5OTA4MmFhYzFjXkEyXkFqcGc@._V1_SX300.jpg,"[{'Source': 'Internet Movie Database', 'Value': '7.3/10'}, {'Source': 'Rotten Tomatoes', 'Value': '83%'}, {'Source': 'Metacritic', 'Value': '74/100'}]",74,7.3,"272,825",tt0119282,movie,N/A,"$99,112,101",N/A,N/A,
513,"Dec 10, 2010",The Tourist,"$100,000,000","$67,631,157","$278,731,369",True,,The Tourist,2010,PG-13,10 Dec 2010,103 min,"Action, Thriller",Florian Henckel von Donnersmarck,"Florian Henckel von Donnersmarck, Christopher McQuarrie, Julian Fellowes","Johnny Depp, Angelina Jolie, Paul Bettany",A tourist on the train to Venice is approached by a mysterious woman for an unusual reason.,"English, French, Italian, Russian, Spanish","United Kingdom, France, Italy, United States",4 wins & 4 nominations total,https://m.media-amazon.com/images/M/MV5BMTMyMzc3OTkwMV5BMl5BanBnXkFtZTcwMjc0MTgwNA@@._V1_SX300.jpg,"[{'Source': 'Internet Movie Database', 'Value': '6.0/10'}, {'Source': 'Rotten Tomatoes', 'Value': '21%'}, {'Source': 'Metacritic', 'Value': '37/100'}]",37,6.0,"264,683",tt1243957,movie,N/A,"$67,631,157",N/A,N/A,
514,"Nov 24, 1999",End of Days,"$100,000,000","$66,889,043","$212,026,975",True,,End of Days,1999,R,24 Nov 1999,122 min,"Action, Fantasy, Horror",Peter Hyams,Andrew W. Marlowe,"Arnold Schwarzenegger, Gabriel Byrne, Robin Tunney","At the end of the century, Satan visits New York in search of a bride. It's up to an ex-cop who now runs an elite security outfit to stop him.","English, Latin, Italian",United States,1 win & 7 nominations total,https://m.media-amazon.com/images/M/MV5BODg2NmE4MTYtMzFmNS00ZWExLWE4YjktNDEwMzg1ZDBkY2JlXkEyXkFqcGc@._V1_SX300.jpg,"[{'Source': 'Internet Movie Database', 'Value': '5.8/10'}, {'Source': 'Rotten Tomatoes', 'Value': '11%'}, {'Source': 'Metacritic', 'Value': '34/100'}]",34,5.8,"120,450",tt0146675,movie,N/A,"$66,889,043",N/A,N/A,
515,"Dec 25, 2019",Spies in Disguise,"$100,000,000","$66,757,013","$165,124,093",True,,Spies in Disguise,2019,PG,25 Dec 2019,102 min,"Animation, Action, Adventure","Nick Bruno, Troy Quane","Lucas Martell, Cindy Davis, Brad Copeland","Rachel Brosnahan, Jarrett Bruno, Claire Crosby","When the world's best spy is turned into a pigeon, he must rely on his nerdy tech officer to save the world.","English, Japanese, Spanish, Korean",United States,4 nominations total,https://m.media-amazon.com/images/M/MV5BZDk1M2NiMjktMjJmMC00MWNiLThhM2MtNjZkZGM1M2Y5NTMxXkEyXkFqcGc@._V1_SX300.jpg,"[{'Source': 'Internet Movie Database', 'Value': '6.8/10'}, {'Source': 'Metacritic', 'Value': '54/100'}]",54,6.8,"60,775",tt5814534,movie,N/A,"$66,757,013",N/A,N/A,
516,"Jun 11, 2004",The Stepford Wives,"$100,000,000","$59,475,623","$96,150,482",True,,The Stepford Wives,2004,PG-13,11 Jun 2004,93 min,"Comedy, Horror, Sci-Fi",Frank Oz,"Ira Levin, Paul Rudnick","Nicole Kidman, Bette Midler, Matthew Broderick",The secret to a Stepford wife lies behind the doors of the Men's Association.,English,United States,3 wins total,https://m.media-amazon.com/images/M/MV5BMjEzNTM4ODM1OF5BMl5BanBnXkFtZTcwNjg4NzAzMw@@._V1_SX300.jpg,"[{'Source': 'Internet Movie Database', 'Value': '5.4/10'}, {'Source': 'Rotten Tomatoes', 'Value': '25%'}, {'Source': 'Metacritic', 'Value': '42/100'}]",42,5.4,"72,613",tt0327162,movie,N/A,"$59,484,742",N/A,N/A,
517,"Jun 8, 2007",Surf’s Up,"$100,000,000","$58,867,694","$145,395,745",True,,Surf's Up,2007,PG,08 Jun 2007,85 min,"Animation, Adventure, Comedy","Ash Brannon, Chris Buck","Don Rhymer, Ash Brannon, Chris Buck","Shia LaBeouf, Zooey Deschanel, Jon Heder","A behind-the-scenes look at the annual Penguin World Surfing Championship, and its newest participant, up-and-comer Cody Maverick.",English,United States,Nominated for 1 Oscar. 2 wins & 18 nominations total,https://m.media-amazon.com/images/M/MV5BMjE4NDE3NzcwM15BMl5BanBnXkFtZTcwMTI0ODYzMw@@._V1_SX300.jpg,"[{'Source': 'Internet Movie Database', 'Value': '6.7/10'}, {'Source': 'Rotten Tomatoes', 'Value': '78%'}, {'Source': 'Metacritic', 'Value': '64/100'}]",64,6.7,"98,614",tt0423294,movie,N/A,"$58,867,694",N/A,N/A,
518,"Dec 8, 2006",Blood Diamond,"$100,000,000","$57,377,916","$171,377,916",True,,Blood Diamond,2006,R,08 Dec 2006,143 min,"Adventure, Drama, Thriller",Edward Zwick,"Charles Leavitt, C. Gaby Mitchell","Leonardo DiCaprio, Djimon Hounsou, Jennifer Connelly","A fisherman, a smuggler, and a syndicate of businessmen match wits over the possession of a priceless diamond.","English, Mende, Afrikaans","United States, Germany, United Kingdom",Nominated for 5 Oscars. 8 wins & 32 nominations total,https://m.media-amazon.com/images/M/MV5BOGYzOGI0YTUtNTAwYy00M2JhLTgyODEtMjlhZTk1Yzc5ZTBhXkEyXkFqcGc@._V1_SX300.jpg,"[{'Source': 'Internet Movie Database', 'Value': '8.0/10'}, {'Source': 'Rotten Tomatoes', 'Value': '64%'}, {'Source': 'Metacritic', 'Value': '64/100'}]",64,8.0,"611,511",tt0450259,movie,N/A,"$57,377,916",N/A,N/A,
519,"Nov 7, 2019",Midway,"$100,000,000","$56,846,802","$126,787,360",True,,Midway,2019,PG-13,08 Nov 2019,138 min,"Action, Drama, History",Roland Emmerich,Wes Tooke,"Ed Skrein, Patrick Wilson, Woody Harrelson","The story of the Battle of Midway, told by the leaders and the sailors who fought in it.","English, Japanese, Mandarin","United States, Canada, China, Hong Kong",1 nomination total,https://m.media-amazon.com/images/M/MV5BZDcyMGVlYzctZjYwNC00MDBiLTg1NDAtNzcxZjlhZTA4NzczXkEyXkFqcGc@._V1_SX300.jpg,"[{'Source': 'Internet Movie Database', 'Value': '6.7/10'}, {'Source': 'Rotten Tomatoes', 'Value': '42%'}, {'Source': 'Metacritic', 'Value': '47/100'}]",47,6.7,"101,830",tt6924650,movie,N/A,"$56,846,802",N/A,N/A,
520,"Sep 24, 2010",Legend of the Guardians: The Owls of Ga’Hoole,"$100,000,000","$55,675,313","$139,716,717",False,Movie not found!,,,,,,,,,,,,,,,,,,,,,,,,,
521,"Jun 5, 2009",Land of the Lost,"$100,000,000","$49,438,370","$69,548,641",True,,Land of the Lost,2009,PG-13,05 Jun 2009,102 min,"Action, Adventure, Comedy",Brad Silberling,"Chris Henchy, Dennis McNicholas, Sid Krofft","Will Ferrell, Danny McBride, Anna Friel","A space-time vortex sucks scientist Rick Marshall, his assistant Holly and a survivalist Will into a world populated by dinosaurs and painfully slow creatures called Sleestaks.",English,United States,2 wins & 9 nominations total,https://m.media-amazon.com/images/M/MV5BOTkzNDg2OTc1NF5BMl5BanBnXkFtZTcwNDcxODE2Mg@@._V1_SX300.jpg,"[{'Source': 'Internet Movie Database', 'Value': '5.3/10'}, {'Source': 'Rotten Tomatoes', 'Value': '27%'}, {'Source': 'Metacritic', 'Value': '32/100'}]",32,5.3,"78,326",tt0457400,movie,N/A,"$49,438,370",N/A,N/A,
522,"Dec 18, 2003",Peter Pan,"$100,000,000","$48,417,850","$95,255,485",True,,Peter Pan,1953,G,05 Feb 1953,77 min,"Animation, Adventure, Family","Clyde Geronimi, Wilfred Jackson, Hamilton Luske","J.M. Barrie, Ted Sears, Erdman Penner","Bobby Driscoll, Kathryn Beaumont, Hans Conried","Wendy and her brothers are whisked away to the magical world of Neverland with the hero of their stories, Peter Pan.","English, American Sign ",United States,2 wins & 2 nominations total,https://m.media-amazon.com/images/M/MV5BOGUwNjg5MWItNTc5OC00MTNkLWEwNzYtYzA1M2Y4MWU3NmQwXkEyXkFqcGc@._V1_SX300.jpg,"[{'Source': 'Internet Movie Database', 'Value': '7.3/10'}, {'Source': 'Rotten Tomatoes', 'Value': '78%'}, {'Source': 'Metacritic', 'Value': '76/100'}]",76,7.3,"162,157",tt0046183,movie,N/A,"$87,404,651",N/A,N/A,
523,"Mar 15, 2019",Wonder Park,"$100,000,000","$45,216,793","$115,103,325",True,,Wonder Park,2019,PG,15 Mar 2019,85 min,"Animation, Adventure, Comedy",Dylan Brown,"Josh Appelbaum, André Nemec, Robert Gordon","Sofia Mali, Jennifer Garner, Ken Hudson Campbell",The imagination of a wildly creative girl comes alive in an amusement park.,"English, French","Spain, United States, United Kingdom, Belgium",1 win & 1 nomination total,https://m.media-amazon.com/images/M/MV5BMjI5MTQ5NzE4Nl5BMl5BanBnXkFtZTgwNTk2MDA5NjM@._V1_SX300.jpg,"[{'Source': 'Internet Movie Database', 'Value': '5.9/10'}, {'Source': 'Rotten Tomatoes', 'Value': '35%'}, {'Source': 'Metacritic', 'Value': '45/100'}]",45,5.9,"13,123",tt6428676,movie,N/A,"$45,216,793",N/A,N/A,
524,"Jul 23, 2004",Catwoman,"$100,000,000","$40,202,379","$82,078,046",True,,Catwoman,2004,PG-13,23 Jul 2004,104 min,"Action, Crime, Fantasy",Pitof,"Bob Kane, Theresa Rebeck, John Brancato","Halle Berry, Sharon Stone, Benjamin Bratt","A shy woman, endowed with the speed, reflexes, and senses of a cat, walks a thin line between criminal and hero, even as a detective doggedly pursues her, fascinated by both of her personas.","English, Spanish",United States,13 wins & 8 nominations total,https://m.media-amazon.com/images/M/MV5BMjA4MzM0NDAzOF5BMl5BanBnXkFtZTcwMDY3MDYyMQ@@._V1_SX300.jpg,"[{'Source': 'Internet Movie Database', 'Value': '3.4/10'}, {'Source': 'Rotten Tomatoes', 'Value': '8%'}, {'Source': 'Metacritic', 'Value': '27/100'}]",27,3.4,"129,770",tt0327554,movie,N/A,"$40,202,379",N/A,N/A,
525,"Aug 14, 2014",The Expendables 3,"$100,000,000","$39,322,544","$209,461,378",True,,The Expendables 3,2014,PG-13,15 Aug 2014,126 min,"Action, Adventure, Comedy",Patrick Hughes,"Sylvester Stallone, Creighton Rothenberger, Katrin Benedikt","Sylvester Stallone, Jason Statham, Jet Li","Barney augments his team with new blood for a personal battle: to take down Conrad Stonebanks, the Expendables co-founder and notorious arms trader who is hell bent on wiping out Barney and every single one of his associates.","English, Romanian, Spanish","United States, France, Germany, Bulgaria",2 wins & 5 nominations total,https://m.media-amazon.com/images/M/MV5BODU5ODMyMzg2MV5BMl5BanBnXkFtZTgwMTA2MTcxMjE@._V1_SX300.jpg,"[{'Source': 'Internet Movie Database', 'Value': '6.1/10'}, {'Source': 'Rotten Tomatoes', 'Value': '32%'}, {'Source': 'Metacritic', 'Value': '35/100'}]",35,6.1,"203,428",tt2333784,movie,N/A,"$39,322,544",N/A,N/A,
526,"Dec 8, 2021",West Side Story,"$100,000,000","$38,530,322","$74,829,369",True,,West Side Story,1961,Approved,23 Dec 1961,153 min,"Crime, Drama, Musical","Jerome Robbins, Robert Wise","Ernest Lehman, Arthur Laurents, Jerome Robbins","Natalie Wood, George Chakiris, Richard Beymer","Two youngsters from rival New York City gangs fall in love, but tensions between their respective friends build toward tragedy.","English, Spanish",United States,Won 10 Oscars. 31 wins & 11 nominations total,https://m.media-amazon.com/images/M/MV5BMTM0NDAxOTI5MF5BMl5BanBnXkFtZTcwNjI4Mjg3NA@@._V1_SX300.jpg,"[{'Source': 'Internet Movie Database', 'Value': '7.6/10'}, {'Source': 'Rotten Tomatoes', 'Value': '92%'}, {'Source': 'Metacritic', 'Value': '86/100'}]",86,7.6,"125,470",tt0055614,movie,N/A,"$44,055,492",N/A,N/A,
527,"Nov 27, 2002",Treasure Planet,"$100,000,000","$38,120,554","$91,800,000",True,,Treasure Planet,2002,PG,29 Nov 2002,95 min,"Animation, Adventure, Family","Ron Clements, John Musker","Robert Louis Stevenson, Ron Clements, John Musker","Joseph Gordon-Levitt, Emma Thompson, Martin Short","Jim Hawkins is a teenager who finds the map of a great treasure hidden by a space pirate. Together with some friends, he sets off in a large spaceship, shaped like a caravel, on his quest.",English,United States,Nominated for 1 Oscar. 1 win & 14 nominations total,https://m.media-amazon.com/images/M/MV5BN2VjNjk5MTAtNDE3Ni00NjczLWFhN2EtNGQ1ZmZmOWRjZjIyXkEyXkFqcGc@._V1_SX300.jpg,"[{'Source': 'Internet Movie Database', 'Value': '7.2/10'}, {'Source': 'Rotten Tomatoes', 'Value': '68%'}, {'Source': 'Metacritic', 'Value': '60/100'}]",60,7.2,"144,235",tt0133240,movie,N/A,"$38,176,783",N/A,N/A,
528,"Dec 22, 2021",The King’s Man,"$100,000,000","$37,176,373","$121,125,300",True,,The King's Man,2021,R,22 Dec 2021,131 min,"Action, Adventure, Thriller",Matthew Vaughn,"Matthew Vaughn, Karl Gajdusek, Mark Millar","Ralph Fiennes, Gemma Arterton, Rhys Ifans","In the early years of the 20th century, the Kingsman agency is formed to stand against a cabal plotting a war to wipe out millions of people.","English, Latin, German, French, Russian","United Kingdom, United States",1 win & 4 nominations total,https://m.media-amazon.com/images/M/MV5BNjY3YTY3MGMtMjVmYS00ZmM3LWIxMDAtYWVhZTAyZDMwNmMwXkEyXkFqcGc@._V1_SX300.jpg,"[{'Source': 'Internet Movie Database', 'Value': '6.3/10'}, {'Source': 'Rotten Tomatoes', 'Value': '41%'}, {'Source': 'Metacritic', 'Value': '44/100'}]",44,6.3,"191,255",tt6856242,movie,N/A,"$37,176,373",N/A,N/A,
529,"Mar 12, 2010",Green Zone,"$100,000,000","$35,497,337","$97,523,020",True,,Green Zone,2010,R,12 Mar 2010,115 min,"Action, Drama, Thriller",Paul Greengrass,"Brian Helgeland, Rajiv Chandrasekaran","Matt Damon, Jason Isaacs, Greg Kinnear",Discovering covert and faulty intelligence causes a U.S. Army officer to go rogue as he hunts for Weapons of Mass Destruction in an unstable region.,"English, Arabic","United Kingdom, France, Spain, Japan, United States",6 nominations total,https://m.media-amazon.com/images/M/MV5BMTYzMTA1NDMyNV5BMl5BanBnXkFtZTcwMzUwODY5Mg@@._V1_SX300.jpg,"[{'Source': 'Internet Movie Database', 'Value': '6.8/10'}, {'Source': 'Rotten Tomatoes', 'Value': '53%'}, {'Source': 'Metacritic', 'Value': '63/100'}]",63,6.8,"146,366",tt0947810,movie,N/A,"$35,053,660",N/A,N/A,
530,"Oct 13, 2017",Geostorm,"$100,000,000","$33,700,160","$223,400,160",True,,Geostorm,2017,PG-13,20 Oct 2017,111 min,"Action, Sci-Fi, Thriller",Dean Devlin,"Dean Devlin, Paul Guyot","Gerard Butler, Jim Sturgess, Abbie Cornish","When the network of satellites designed to control the global climate starts to attack Earth, it's a race against the clock for its creator to uncover the real threat before a worldwide Geostorm wipes out everything and everyone.","English, Cantonese, Czech, Hungarian, Italian, Korean","United States, Hong Kong",1 win & 1 nomination total,https://m.media-amazon.com/images/M/MV5BMTA0OTQwMTIxNzheQTJeQWpwZ15BbWU4MDQ1MzI3OTMy._V1_SX300.jpg,"[{'Source': 'Internet Movie Database', 'Value': '5.4/10'}, {'Source': 'Rotten Tomatoes', 'Value': '18%'}, {'Source': 'Metacritic', 'Value': '21/100'}]",21,5.4,"129,903",tt1981128,movie,N/A,"$33,700,160",N/A,N/A,
531,"Dec 2, 2015",Point Break,"$100,000,000","$28,782,481","$133,782,481",True,,Point Break,1991,R,12 Jul 1991,122 min,"Action, Crime, Thriller",Kathryn Bigelow,"Rick King, W. Peter Iliff","Patrick Swayze, Keanu Reeves, Gary Busey",An F.B.I. Agent goes undercover to catch a gang of surfers who may be bank robbers.,English,"United States, Japan",1 win & 2 nominations total,https://m.media-amazon.com/images/M/MV5BNTI3YzY3N2MtODI1OC00NmU0LThlMDYtNmFjMGFkNzhhNTRlXkEyXkFqcGc@._V1_SX300.jpg,"[{'Source': 'Internet Movie Database', 'Value': '7.3/10'}, {'Source': 'Rotten Tomatoes', 'Value': '69%'}, {'Source': 'Metacritic', 'Value': '60/100'}]",60,7.3,"217,483",tt0102685,movie,N/A,"$43,218,387",N/A,N/A,
532,"Dec 17, 2019",Cats,"$100,000,000","$27,166,770","$75,298,476",True,,Cats,2019,PG,20 Dec 2019,110 min,"Comedy, Drama, Family",Tom Hooper,"Lee Hall, Tom Hooper, Andrew Lloyd Webber","James Corden, Judi Dench, Jason Derulo",A tribe of cats called the Jellicles must decide yearly which one will ascend to the Heaviside Layer and come back to a new Jellicle life.,English,"United Kingdom, United States, Canada, Australia, Japan, China",11 wins & 8 nominations total,https://m.media-amazon.com/images/M/MV5BYjhmMjcxNDUtNmVjZS00MjA1LTgzZjgtOTRjMTk4YjU1NDcwXkEyXkFqcGc@._V1_SX300.jpg,"[{'Source': 'Internet Movie Database', 'Value': '2.8/10'}, {'Source': 'Rotten Tomatoes', 'Value': '19%'}, {'Source': 'Metacritic', 'Value': '32/100'}]",32,2.8,"57,855",tt5697572,movie,N/A,"$27,166,770",N/A,N/A,
533,"Nov 26, 2015",In the Heart of the Sea,"$100,000,000","$25,020,758","$94,320,758",True,,In the Heart of the Sea,2015,PG-13,11 Dec 2015,122 min,"Action, Adventure, Biography",Ron Howard,"Charles Leavitt, Rick Jaffa, Amanda Silver","Chris Hemsworth, Cillian Murphy, Brendan Gleeson","A recounting of a New England whaling ship's sinking by a giant whale in 1820, an experience that later inspired the great novel Moby-Dick.",English,"United States, Australia, Spain",1 win & 6 nominations total,https://m.media-amazon.com/images/M/MV5BMjA5NzUwODExM15BMl5BanBnXkFtZTgwNjM0MzE4NjE@._V1_SX300.jpg,"[{'Source': 'Internet Movie Database', 'Value': '6.9/10'}, {'Source': 'Rotten Tomatoes', 'Value': '42%'}, {'Source': 'Metacritic', 'Value': '47/100'}]",47,6.9,"156,836",tt1390411,movie,N/A,"$25,020,758",N/A,N/A,
