index,Release Date,Title_x,Production Budget,Domestic Gross,Worldwide Gross,Response,Error,Title_y,Year,Rated,Released,Runtime,Genre,Director,Writer,Actors,Plot,Language,Country,Awards,Poster,Ratings,Metascore,imdbRating,imdbVotes,imdbID,Type,DVD,BoxOffice,Production,Website,totalSeasons
726,"Sep 26, 2008",Eagle Eye,"$80,000,000","$101,440,743","$180,585,259",True,,Eagle Eye,2008,PG-13,26 Sep 2008,118 min,"Action, Mystery, Thriller",D.J. Caruso,"John Glenn, Travis Wright, Hillary Seitz","Shia LaBeouf, Michelle Monaghan, Rosario Dawson","Jerry and Rachel are two strangers thrown together by a mysterious phone call from a woman they have never met. Threatening their lives and family, she pushes Jerry and Rachel into a series of increasingly dangerous situations, us...",English,"United Kingdom, Germany, United States",3 wins & 8 nominations total,https://m.media-amazon.com/images/M/MV5BMjA5MTMzMDMzNl5BMl5BanBnXkFtZTcwMzUwNDUzMw@@._V1_SX300.jpg,"[{'Source': 'Internet Movie Database', 'Value': '6.6/10'}, {'Source': 'Rotten Tomatoes', 'Value': '27%'}, {'Source': 'Metacritic', 'Value': '43/100'}]",43,6.6,"199,841",tt1059786,movie,N/A,"$101,440,743",N/A,N/A,
727,"Jun 6, 1997",Con Air,"$80,000,000","$101,117,573","$224,117,573",True,,Con Air,1997,R,06 Jun 1997,115 min,"Action, Crime, Thriller",Simon West,Scott Rosenberg,"Nicolas Cage, John Cusack, John Malkovich","Former US Army Ranger, Cameron Poe, has just been paroled for manslaughter, but must stop a group of violent and deadly criminals from escaping the country after they seize control of the prison transport plane he is on.","English, Spanish",United States,Nominated for 2 Oscars. 7 wins & 11 nominations total,https://m.media-amazon.com/images/M/MV5BODcxOGFjOTEtM2M3Zi00ZWNiLWFjMTYtZDQ0Yjg2NTE2MzNiXkEyXkFqcGc@._V1_SX300.jpg,"[{'Source': 'Internet Movie Database', 'Value': '6.9/10'}, {'Source': 'Rotten Tomatoes', 'Value': '58%'}, {'Source': 'Metacritic', 'Value': '52/100'}]",52,6.9,"334,216",tt0118880,movie,N/A,"$101,117,573",N/A,N/A,
728,"Dec 17, 2010",Yogi Bear,"$80,000,000","$100,246,011","$204,774,690",True,,Yogi Bear,2010,PG,17 Dec 2010,80 min,"Animation, Adventure, Comedy",Eric Brevig,"Jennifer Ventimilia, Joshua Sternin, Brad Copeland","Dan Aykroyd, Justin Timberlake, Anna Faris","A documentary filmmaker travels to Jellystone Park to shoot a project and soon crosses paths with Yogi Bear, his sidekick Boo-Boo and Ranger Smith.",English,"United States, New Zealand",2 wins & 2 nominations total,https://m.media-amazon.com/images/M/MV5BMTczMjU1NTQ0M15BMl5BanBnXkFtZTcwMjIxMTA3Mw@@._V1_SX300.jpg,"[{'Source': 'Internet Movie Database', 'Value': '4.6/10'}, {'Source': 'Rotten Tomatoes', 'Value': '13%'}, {'Source': 'Metacritic', 'Value': '35/100'}]",35,4.6,"24,066",tt1302067,movie,N/A,"$100,246,011",N/A,N/A,
729,"Dec 25, 2003",Cold Mountain,"$80,000,000","$95,632,614","$165,173,909",True,,Cold Mountain,2003,R,25 Dec 2003,154 min,"Adventure, Drama, Romance",Anthony Minghella,"Charles Frazier, Anthony Minghella","Jude Law, Nicole Kidman, Renée Zellweger","In the waning days of the American Civil War, a wounded soldier embarks on a perilous journey back home to Cold Mountain, North Carolina to reunite with his sweetheart.",English,"United States, Italy, Romania",Won 1 Oscar. 20 wins & 101 nominations total,https://m.media-amazon.com/images/M/MV5BMTY3NTc5NzcyOF5BMl5BanBnXkFtZTcwMDM0NjQyMQ@@._V1_SX300.jpg,"[{'Source': 'Internet Movie Database', 'Value': '7.2/10'}, {'Source': 'Rotten Tomatoes', 'Value': '69%'}, {'Source': 'Metacritic', 'Value': '73/100'}]",73,7.2,"162,013",tt0159365,movie,N/A,"$95,636,509",N/A,N/A,
730,"Jan 15, 2010",The Book of Eli,"$80,000,000","$94,835,059","$158,750,817",True,,The Book of Eli,2010,R,15 Jan 2010,118 min,"Action, Adventure, Drama","Albert Hughes, Allen Hughes",Gary Whitta,"Denzel Washington, Mila Kunis, Ray Stevenson","A drifter fights his way across a ravaged, post-apocalyptic America while protecting a sacred book that holds the secrets to humanity's salvation.",English,United States,3 wins & 16 nominations total,https://m.media-amazon.com/images/M/MV5BZjk4N2U2YTAtNWEzZC00N2VmLTlkNDctMjg5YjI4OTExZTFhXkEyXkFqcGc@._V1_SX300.jpg,"[{'Source': 'Internet Movie Database', 'Value': '6.8/10'}, {'Source': 'Rotten Tomatoes', 'Value': '46%'}, {'Source': 'Metacritic', 'Value': '53/100'}]",53,6.8,"354,627",tt1037705,movie,N/A,"$94,835,059",N/A,N/A,
731,"Nov 26, 1997",Flubber,"$80,000,000","$92,993,801","$177,993,801",True,,Flubber,1997,PG,26 Nov 1997,93 min,"Comedy, Family, Sci-Fi",Les Mayfield,"Samuel W. Taylor, John Hughes, Bill Walsh","Robin Williams, Marcia Gay Harden, Christopher McDonald","An absent-minded professor discovers ""flubber,"" a rubber-like super-bouncy substance.",English,United States,3 wins & 2 nominations total,https://m.media-amazon.com/images/M/MV5BMTIxNDgwNWUtYzM4OS00NzU4LWFkYjgtZDdlNzBiZjM3YmI0XkEyXkFqcGc@._V1_SX300.jpg,"[{'Source': 'Internet Movie Database', 'Value': '5.3/10'}, {'Source': 'Rotten Tomatoes', 'Value': '24%'}, {'Source': 'Metacritic', 'Value': '38/100'}]",38,5.3,"97,679",tt0119137,movie,N/A,"$92,977,226",N/A,N/A,
732,"Jul 23, 1999",The Haunting,"$80,000,000","$91,188,905","$180,188,905",True,,The Haunting,1999,PG-13,23 Jul 1999,113 min,"Fantasy, Horror, Mystery",Jan de Bont,"David Self, Shirley Jackson","Liam Neeson, Catherine Zeta-Jones, Owen Wilson","Dr Marrow enlists Theo, Luke and Nell for a study of sleep disorders at the Hill House. As soon as the terrifying truth about the mansion is revealed, everyone is found fighting for their lives.",English,United States,4 wins & 14 nominations total,https://m.media-amazon.com/images/M/MV5BN2E0OWZlNDAtODQxOS00ZjIwLTlhOTMtM2ZhNzZmYWVmOWQxXkEyXkFqcGc@._V1_SX300.jpg,"[{'Source': 'Internet Movie Database', 'Value': '5.0/10'}, {'Source': 'Rotten Tomatoes', 'Value': '17%'}, {'Source': 'Metacritic', 'Value': '42/100'}]",42,5.0,"82,177",tt0171363,movie,N/A,"$91,411,151",N/A,N/A,
733,"Nov 15, 1996",Space Jam,"$80,000,000","$90,463,534","$250,180,384",True,,Space Jam,1996,PG,15 Nov 1996,88 min,"Animation, Adventure, Comedy",Joe Pytka,"Leo Benvenuti, Steve Rudnick, Timothy Harris","Michael Jordan, Wayne Knight, Theresa Randle","In a desperate attempt to win a basketball match and earn their freedom, the Looney Tunes seek the aid of retired basketball champion, Michael Jordan.",English,United States,5 wins & 8 nominations total,https://m.media-amazon.com/images/M/MV5BZGQ3ZDk0M2MtZDNmNi00OWE3LThiODUtMTU3NmVjMTA0ZGQyXkEyXkFqcGc@._V1_SX300.jpg,"[{'Source': 'Internet Movie Database', 'Value': '6.5/10'}, {'Source': 'Rotten Tomatoes', 'Value': '43%'}, {'Source': 'Metacritic', 'Value': '57/100'}]",57,6.5,"225,814",tt0117705,movie,N/A,"$90,594,962",N/A,N/A,
734,"Oct 17, 2014",Fury,"$80,000,000","$85,817,906","$210,221,008",True,,Fury,2014,R,17 Oct 2014,134 min,"Action, Drama, War",David Ayer,David Ayer,"Brad Pitt, Shia LaBeouf, Logan Lerman","A grizzled tank commander makes tough decisions as he and his crew fight their way across Germany in April, 1945.","English, German","United States, China",6 wins & 23 nominations total,https://m.media-amazon.com/images/M/MV5BMjA4MDU0NTUyN15BMl5BanBnXkFtZTgwMzQxMzY4MjE@._V1_SX300.jpg,"[{'Source': 'Internet Movie Database', 'Value': '7.6/10'}, {'Source': 'Rotten Tomatoes', 'Value': '75%'}, {'Source': 'Metacritic', 'Value': '64/100'}]",64,7.6,"590,658",tt2713180,movie,N/A,"$85,817,906",N/A,N/A,
735,"Sep 21, 2018",Smallfoot,"$80,000,000","$83,240,103","$217,940,103",True,,Smallfoot,2018,PG,28 Sep 2018,96 min,"Animation, Adventure, Comedy","Karey Kirkpatrick, Jason Reisig","Karey Kirkpatrick, Clare Sera, John Requa","Channing Tatum, James Corden, Zendaya","When a Yeti discovers a human and his fellow Yeti refuse to believe humans exist, he embarks on an journey to find the creature that can put him back in his community's good graces.","English, Mandarin",United States,1 win & 14 nominations total,https://m.media-amazon.com/images/M/MV5BZjBjYWQxMTQtMThiZS00NjZkLWE1ZjctMzE2ZTgxZmJmMWQ1XkEyXkFqcGc@._V1_SX300.jpg,"[{'Source': 'Internet Movie Database', 'Value': '6.6/10'}, {'Source': 'Rotten Tomatoes', 'Value': '76%'}, {'Source': 'Metacritic', 'Value': '60/100'}]",60,6.6,"44,669",tt6182908,movie,N/A,"$83,315,531",N/A,N/A,
736,"Feb 10, 2006",The Pink Panther,"$80,000,000","$82,226,474","$158,926,474",True,,The Pink Panther,2006,PG,10 Feb 2006,93 min,"Adventure, Comedy, Crime",Shawn Levy,"Len Blum, Steve Martin, Michael Saltzman","Steve Martin, Kevin Kline, Jean Reno",Bumbling Inspector Clouseau must solve the murder of a famous soccer coach and find out who stole the infamous Pink Panther diamond.,English,"Czech Republic, United States",1 win & 8 nominations total,https://m.media-amazon.com/images/M/MV5BZTE2ODdmMTktNmEwMy00ZDZmLWJmNDAtYTEyN2FjYjcwM2M1XkEyXkFqcGc@._V1_SX300.jpg,"[{'Source': 'Internet Movie Database', 'Value': '5.7/10'}, {'Source': 'Rotten Tomatoes', 'Value': '21%'}, {'Source': 'Metacritic', 'Value': '38/100'}]",38,5.7,"96,320",tt0383216,movie,N/A,"$82,226,474",N/A,N/A,
737,"Jul 23, 2025",The Bad Guys 2,"$80,000,000","$82,194,100","$230,911,100",True,,The Bad Guys 2,2025,PG,01 Aug 2025,104 min,"Animation, Action, Adventure","JP Sans, Pierre Perifel","Yoni Brenner, Etan Cohen, Aaron Blabey","Sam Rockwell, Marc Maron, Awkwafina","The Bad Guys are struggling to find trust and acceptance in their newly minted lives as Good Guys, when they are pulled out of retirement and forced to do ""one last job"" by an all-female squad of criminals.",English,United States,N/A,https://m.media-amazon.com/images/M/MV5BY2YwODhmODctMjE2OS00Y2EyLWEyZTEtOGU3ODk5MGIzYmU1XkEyXkFqcGc@._V1_SX300.jpg,"[{'Source': 'Internet Movie Database', 'Value': '7.1/10'}, {'Source': 'Rotten Tomatoes', 'Value': '88%'}, {'Source': 'Metacritic', 'Value': '64/100'}]",64,7.1,"16,096",tt30017619,movie,N/A,"$81,190,505",N/A,N/A,
738,"Jul 8, 2011",Zookeeper,"$80,000,000","$80,360,866","$170,805,525",True,,Zookeeper,2011,PG,08 Jul 2011,102 min,"Comedy, Family, Fantasy",Frank Coraci,"Nick Bakay, Rock Reuben, Kevin James","Kevin James, Rosario Dawson, Leslie Bibb","A group of zoo animals decide to break their code of silence in order to help their lovable zookeeper find love, without opting to leave his current job for something more illustrious.",English,United States,1 win & 2 nominations total,https://m.media-amazon.com/images/M/MV5BMTMyNjYyODk0Ml5BMl5BanBnXkFtZTcwNDUzOTczNQ@@._V1_SX300.jpg,"[{'Source': 'Internet Movie Database', 'Value': '5.2/10'}, {'Source': 'Rotten Tomatoes', 'Value': '13%'}, {'Source': 'Metacritic', 'Value': '30/100'}]",30,5.2,"68,404",tt1222817,movie,N/A,"$80,360,843",N/A,N/A,
739,"Dec 12, 2008",The Day the Earth Stood Still,"$80,000,000","$79,366,978","$237,370,350",True,,The Day the Earth Stood Still,2008,PG-13,12 Dec 2008,104 min,"Adventure, Drama, Sci-Fi",Scott Derrickson,"David Scarpa, Edmund H. North","Keanu Reeves, Jennifer Connelly, Kathy Bates",A remake of the 1951 classic science fiction film about an alien visitor and his giant robot counterpart who visit Earth.,"English, Mandarin","United States, Canada",2 wins & 5 nominations total,https://m.media-amazon.com/images/M/MV5BMTI5NTg1MzU5Nl5BMl5BanBnXkFtZTcwMDU1ODMwMg@@._V1_SX300.jpg,"[{'Source': 'Internet Movie Database', 'Value': '5.5/10'}, {'Source': 'Rotten Tomatoes', 'Value': '21%'}, {'Source': 'Metacritic', 'Value': '40/100'}]",40,5.5,"183,809",tt0970416,movie,N/A,"$79,366,978",N/A,N/A,
740,"Aug 8, 1997",Conspiracy Theory,"$80,000,000","$76,118,990","$142,783,718",True,,Conspiracy Theory,1997,R,08 Aug 1997,135 min,"Action, Drama, Mystery",Richard Donner,Brian Helgeland,"Mel Gibson, Julia Roberts, Patrick Stewart","A taxi driver with a penchant for conspiracy theories becomes a target after one of these theories turns out to be true. Unfortunately, to save himself, he has to figure out which theory it is.",English,United States,4 wins & 1 nomination total,https://m.media-amazon.com/images/M/MV5BMjQ1MTYxMzA4OF5BMl5BanBnXkFtZTgwNjg2NTM1MTI@._V1_SX300.jpg,"[{'Source': 'Internet Movie Database', 'Value': '6.7/10'}, {'Source': 'Rotten Tomatoes', 'Value': '58%'}, {'Source': 'Metacritic', 'Value': '50/100'}]",50,6.7,"111,559",tt0118883,movie,N/A,"$75,982,834",N/A,N/A,
741,"Jun 12, 1998","Six Days, Seven Nights","$80,000,000","$74,339,294","$164,800,000",True,,Six Days Seven Nights,1998,PG-13,12 Jun 1998,102 min,"Action, Adventure, Comedy",Ivan Reitman,Michael Browning,"Harrison Ford, Anne Heche, David Schwimmer","Robin Monroe, a New York magazine editor, and the gruff pilot Quinn Harris must put aside their mutual dislike if they are to survive after crash landing on a deserted South Seas island.","English, German",United States,2 wins & 5 nominations total,https://m.media-amazon.com/images/M/MV5BYzFhZDg3MDYtNGIxYi00MDBlLTg3OWUtNTMwYjcxMjc2ZTYwXkEyXkFqcGc@._V1_SX300.jpg,"[{'Source': 'Internet Movie Database', 'Value': '5.9/10'}, {'Source': 'Rotten Tomatoes', 'Value': '40%'}, {'Source': 'Metacritic', 'Value': '51/100'}]",51,5.9,"86,273",tt0120828,movie,N/A,"$74,339,294",N/A,N/A,
742,"May 24, 2002",Spirit: Stallion of the Cimarron,"$80,000,000","$73,215,310","$106,515,310",True,,Spirit: Stallion of the Cimarron,2002,G,24 May 2002,83 min,"Animation, Adventure, Drama","Kelly Asbury, Lorna Cook",John Fusco,"Matt Damon, James Cromwell, Daniel Studi",A captured mustang remains determined to return to his herd no matter what.,English,"United States, Canada",Nominated for 1 Oscar. 10 wins & 22 nominations total,https://m.media-amazon.com/images/M/MV5BMTgyOTUzNDA1N15BMl5BanBnXkFtZTYwNjgwMDM3._V1_SX300.jpg,"[{'Source': 'Internet Movie Database', 'Value': '7.2/10'}, {'Source': 'Rotten Tomatoes', 'Value': '69%'}, {'Source': 'Metacritic', 'Value': '52/100'}]",52,7.2,"91,688",tt0166813,movie,N/A,"$73,280,117",N/A,N/A,
743,"Jun 8, 2001",Swordfish,"$80,000,000","$69,772,969","$147,080,413",True,,Swordfish,2001,R,08 Jun 2001,99 min,"Action, Crime, Thriller",Dominic Sena,Skip Woods,"John Travolta, Hugh Jackman, Halle Berry","A covert counter-terrorist unit called Black Cell led by Gabriel Shear wants the money to help finance their war against international terrorism, but it's all locked away. Gabriel brings in convicted hacker Stanley Jobson to help ...","English, German",United States,5 wins & 10 nominations total,https://m.media-amazon.com/images/M/MV5BMmVlOGM1YjQtNzMzYS00ZmY5LTlkMDQtN2EyZTQ4NTExNjNjXkEyXkFqcGc@._V1_SX300.jpg,"[{'Source': 'Internet Movie Database', 'Value': '6.5/10'}, {'Source': 'Rotten Tomatoes', 'Value': '27%'}, {'Source': 'Metacritic', 'Value': '32/100'}]",32,6.5,"201,658",tt0244244,movie,N/A,"$69,772,969",N/A,N/A,
744,"Apr 3, 1998",Lost In Space,"$80,000,000","$69,117,629","$136,047,317",True,,Lost in Space,2018–2021,TV-PG,13 Apr 2018,60 min,"Adventure, Drama, Family",N/A,"Irwin Allen, Matt Sazama, Burk Sharpless","Molly Parker, Toby Stephens, Maxwell Jenkins","After crash-landing on an alien planet, the Robinson family fight against all odds to survive and escape, but they're surrounded by hidden dangers.",English,United States,Nominated for 3 Primetime Emmys. 8 wins & 31 nominations total,https://m.media-amazon.com/images/M/MV5BMTU1MzAwODM4OF5BMl5BanBnXkFtZTgwMjA4OTY5NDM@._V1_SX300.jpg,"[{'Source': 'Internet Movie Database', 'Value': '7.3/10'}]",N/A,7.3,"110,555",tt5232792,series,,,,,3
745,"Jul 30, 2004",The Manchurian Candidate,"$80,000,000","$65,948,711","$96,135,872",True,,The Manchurian Candidate,2004,R,30 Jul 2004,129 min,"Drama, Mystery, Sci-Fi",Jonathan Demme,"Richard Condon, George Axelrod, Daniel Pyne","Denzel Washington, Liev Schreiber, Meryl Streep","In the midst of the Gulf War, soldiers are kidnapped and brainwashed for sinister purposes.",English,United States,Nominated for 1 BAFTA Award1 win & 12 nominations total,https://m.media-amazon.com/images/M/MV5BMGVkNDJkYWYtYjE4Yy00OTEzLThkOTUtZTJiMjRkYzliNDk3XkEyXkFqcGc@._V1_SX300.jpg,"[{'Source': 'Internet Movie Database', 'Value': '6.6/10'}, {'Source': 'Rotten Tomatoes', 'Value': '79%'}, {'Source': 'Metacritic', 'Value': '76/100'}]",76,6.6,"121,188",tt0368008,movie,N/A,"$65,955,630",N/A,N/A,
746,"Apr 23, 2025",The Accountant 2,"$80,000,000","$65,523,366","$103,223,366",True,,The Accountant 2,2025,R,25 Apr 2025,132 min,"Action, Crime, Drama",Gavin O'Connor,Bill Dubuque,"Ben Affleck, Jon Bernthal, Cynthia Addai-Robinson",Christian Wolff applies his brilliant mind and illegal methods to reconstruct the unsolved puzzle of a Treasury chief's murder.,"English, Spanish, Korean, German",United States,1 win & 3 nominations total,https://m.media-amazon.com/images/M/MV5BYjFiY2I0NTEtNjdjNy00MTljLThkOWYtMzNiYjYyMDcxYjhkXkEyXkFqcGc@._V1_SX300.jpg,"[{'Source': 'Internet Movie Database', 'Value': '6.6/10'}, {'Source': 'Rotten Tomatoes', 'Value': '75%'}, {'Source': 'Metacritic', 'Value': '58/100'}]",58,6.6,"111,281",tt7068946,movie,N/A,"$65,523,366",N/A,N/A,
747,"Nov 22, 2006",Déjà Vu,"$80,000,000","$64,038,616","$181,038,616",True,,Déjà Vu,1997,PG-13,22 Apr 1998,117 min,"Drama, Romance",Henry Jaglom,"Victoria Foyt, Henry Jaglom","Victoria Foyt, Stephen Dillane, Vanessa Redgrave","L.A. shop owner Dana and Englishman Sean meet and fall in love at first sight, but Sean is married and Dana is to marry her business partner Alex.",English,United States,1 nomination,https://m.media-amazon.com/images/M/MV5BMTg3OTk3NDAzNV5BMl5BanBnXkFtZTcwMTYyNjAyMQ@@._V1_SX300.jpg,"[{'Source': 'Internet Movie Database', 'Value': '6.8/10'}]",N/A,6.8,970,tt0119033,movie,N/A,"$1,086,181",N/A,N/A,
748,"Jun 24, 2005",Bewitched,"$80,000,000","$63,313,159","$131,159,306",True,,Bewitched,2005,PG-13,24 Jun 2005,102 min,"Comedy, Fantasy, Romance",Nora Ephron,"Nora Ephron, Delia Ephron, Sol Saks","Nicole Kidman, Will Ferrell, Shirley MacLaine","Thinking he can overshadow an unknown actress in the part, an egocentric actor unknowingly gets a witch cast in an upcoming television remake of the classic sitcom Bewitched (1964).","English, Spanish",United States,2 wins & 13 nominations total,https://m.media-amazon.com/images/M/MV5BYjMyYmE4YzItOTk0OS00NjNkLWEwODgtMTEzNjRjYWZjMjE5XkEyXkFqcGc@._V1_SX300.jpg,"[{'Source': 'Internet Movie Database', 'Value': '4.8/10'}, {'Source': 'Rotten Tomatoes', 'Value': '23%'}, {'Source': 'Metacritic', 'Value': '34/100'}]",34,4.8,"77,303",tt0374536,movie,N/A,"$63,313,159",N/A,N/A,
749,"Dec 31, 1999",Fantasia 2000,"$80,000,000","$60,507,228","$60,518,248",True,,Fantasia 2000,1999,G,16 Jun 2000,75 min,"Animation, Family, Fantasy","James Algar, Gaëtan Brizzi, Paul Brizzi","Eric Goldberg, James Fujii, Joe Grant","James Levine, Steve Martin, Itzhak Perlman",An update of the original film with new interpretations of great works of classical music.,English,United States,4 wins & 7 nominations total,https://m.media-amazon.com/images/M/MV5BNDE3YTU1ZTktZGQzYy00YWYwLWFhNjMtNmZiZTYwOWM4Y2U0XkEyXkFqcGc@._V1_SX300.jpg,"[{'Source': 'Internet Movie Database', 'Value': '7.1/10'}, {'Source': 'Rotten Tomatoes', 'Value': '80%'}, {'Source': 'Metacritic', 'Value': '59/100'}]",59,7.1,"43,005",tt0120910,movie,N/A,"$60,655,420",N/A,N/A,
750,"Dec 22, 2006",The Good Shepherd,"$80,000,000","$59,908,565","$100,378,271",True,,The Good Shepherd,2006,R,22 Dec 2006,167 min,"Drama, History, Thriller",Robert De Niro,Eric Roth,"Matt Damon, Angelina Jolie, Robert De Niro",The tumultuous early history of the Central Intelligence Agency is viewed through the prism of one man's life.,"English, Spanish, Russian, German, Lingala","United States, France",Nominated for 1 Oscar. 2 wins & 13 nominations total,https://m.media-amazon.com/images/M/MV5BMTU5MjExMzA1Nl5BMl5BanBnXkFtZTgwMzIxNzQxMTE@._V1_SX300.jpg,"[{'Source': 'Internet Movie Database', 'Value': '6.7/10'}, {'Source': 'Rotten Tomatoes', 'Value': '56%'}, {'Source': 'Metacritic', 'Value': '61/100'}]",61,6.7,"111,250",tt0343737,movie,N/A,"$59,952,835",N/A,N/A,
751,"Mar 8, 2002",The Time Machine,"$80,000,000","$56,684,819","$98,983,590",True,,The Time Machine,2002,PG-13,08 Mar 2002,96 min,"Action, Adventure, Sci-Fi",Simon Wells,"H.G. Wells, David Duncan, John Logan","Guy Pearce, Yancey Arias, Mark Addy","Hoping to alter the events of the past, a 19th century inventor instead travels 800,000 years into the future, where he finds humankind divided into two warring races.",English,"United States, United Arab Emirates",Nominated for 1 Oscar. 2 wins & 4 nominations total,https://m.media-amazon.com/images/M/MV5BZjRiMTdjNmEtOGJjNy00ZjA1LTlkNzktNzc0NzMxNTY0OGE5XkEyXkFqcGc@._V1_SX300.jpg,"[{'Source': 'Internet Movie Database', 'Value': '6.0/10'}, {'Source': 'Rotten Tomatoes', 'Value': '28%'}, {'Source': 'Metacritic', 'Value': '42/100'}]",42,6.0,"133,796",tt0268695,movie,N/A,"$56,832,494",N/A,N/A,
752,"Oct 2, 1998",What Dreams May Come,"$80,000,000","$55,485,043","$71,485,043",True,,What Dreams May Come,1998,PG-13,02 Oct 1998,113 min,"Drama, Fantasy, Romance",Vincent Ward,"Richard Matheson, Ron Bass","Robin Williams, Cuba Gooding Jr., Annabella Sciorra","Chris Nielsen dies in an accident, and enters Heaven. But when he discovers that his beloved wife Annie has killed herself out of grief over the loss, he embarks on an afterlife adventure to reunite with her.",English,"New Zealand, United States",Won 1 Oscar. 7 wins & 2 nominations total,https://m.media-amazon.com/images/M/MV5BOWVmNzA5NDQtYTNiYy00YjI0LWJjMWItZjEyNmI5YjRlZTI5XkEyXkFqcGc@._V1_SX300.jpg,"[{'Source': 'Internet Movie Database', 'Value': '7.0/10'}, {'Source': 'Rotten Tomatoes', 'Value': '51%'}, {'Source': 'Metacritic', 'Value': '44/100'}]",44,7.0,"117,520",tt0120889,movie,N/A,"$55,382,927",N/A,N/A,
753,"Dec 25, 1998",Mighty Joe Young,"$80,000,000","$50,632,037","$50,632,037",True,,Mighty Joe Young,1998,PG,25 Dec 1998,114 min,"Action, Adventure, Family",Ron Underwood,"Merian C. Cooper, Ruth Rose, Mark Rosenthal","Bill Paxton, Charlize Theron, Rade Serbedzija","A legendary fifteen-foot tall mountain gorilla named Joe is taken to an animal sanctuary in California by zoologist Gregg O'Hara (Bill Paxton) and Jill Young (Charlize Theron), with whom he grew up. Poacher Strasser (Rade Serbedzi...","English, Swahili","United States, United Kingdom",Nominated for 1 Oscar. 1 win & 4 nominations total,https://m.media-amazon.com/images/M/MV5BYjViMWExYzItMjBkNS00YTFkLWFmOWItMGVmNWFjMjg3OGE2XkEyXkFqcGc@._V1_SX300.jpg,"[{'Source': 'Internet Movie Database', 'Value': '5.7/10'}, {'Source': 'Rotten Tomatoes', 'Value': '55%'}, {'Source': 'Metacritic', 'Value': '51/100'}]",51,5.7,"31,958",tt0120751,movie,N/A,"$50,632,037",N/A,N/A,
754,"Sep 19, 2019",Ad Astra,"$80,000,000","$50,188,370","$135,154,826",True,,Ad Astra,2019,PG-13,20 Sep 2019,123 min,"Adventure, Drama, Mystery",James Gray,"James Gray, Ethan Gross","Brad Pitt, Tommy Lee Jones, Ruth Negga","Astronaut Roy McBride undertakes a mission across an unforgiving solar system to uncover the truth about his missing father and his doomed expedition that now, 30 years later, threatens the universe.","English, Norwegian","United States, China, Brazil",Nominated for 1 Oscar. 10 wins & 75 nominations total,https://m.media-amazon.com/images/M/MV5BOGRhOGNjZjEtNTU2Ni00MDlmLWI3MWEtNzc1OGE2ZmEwZGNhXkEyXkFqcGc@._V1_SX300.jpg,"[{'Source': 'Internet Movie Database', 'Value': '6.5/10'}, {'Source': 'Rotten Tomatoes', 'Value': '83%'}, {'Source': 'Metacritic', 'Value': '80/100'}]",80,6.5,"273,135",tt2935510,movie,N/A,"$50,188,370",N/A,N/A,
755,"Oct 28, 2005",The Legend of Zorro,"$80,000,000","$45,575,336","$141,475,336",True,,The Legend of Zorro,2005,PG,28 Oct 2005,129 min,"Action, Adventure, Drama",Martin Campbell,"Roberto Orci, Alex Kurtzman, Ted Elliott","Antonio Banderas, Catherine Zeta-Jones, Rufus Sewell","Despite trying to keep his swashbuckling to a minimum, a threat to California's pending statehood causes the adventure-loving Don Alejandro de la Vega and his wife, Elena, to take action.","English, Spanish",United States,2 wins & 3 nominations total,https://m.media-amazon.com/images/M/MV5BZjM3OGM3ZjYtYTA3YS00OTc5LWE0M2UtZTNiZjc2Yzg0ZTlhXkEyXkFqcGc@._V1_SX300.jpg,"[{'Source': 'Internet Movie Database', 'Value': '6.0/10'}, {'Source': 'Rotten Tomatoes', 'Value': '27%'}, {'Source': 'Metacritic', 'Value': '47/100'}]",47,6.0,"112,175",tt0386140,movie,N/A,"$46,464,023",N/A,N/A,
756,"Feb 14, 2024",Madame Web,"$80,000,000","$43,817,106","$100,298,817",True,,Madame Web,2024,PG-13,14 Feb 2024,116 min,"Action, Thriller",S.J. Clarkson,"Matt Sazama, Burk Sharpless, Claire Parker","Dakota Johnson, Sydney Sweeney, Isabela Merced","Forced to confront her past, Cassandra Webb, a Manhattan paramedic that may have clairvoyant abilities, forms a relationship with three young women destined for powerful futures, if they can survive their threatening present.","English, Spanish","United States, Mexico, Canada",6 wins & 7 nominations total,https://m.media-amazon.com/images/M/MV5BODViOTZiOTQtOTc4ZC00ZjUxLWEzMjItY2ExMmNlNDliNjE4XkEyXkFqcGc@._V1_SX300.jpg,"[{'Source': 'Internet Movie Database', 'Value': '4.1/10'}, {'Source': 'Rotten Tomatoes', 'Value': '10%'}, {'Source': 'Metacritic', 'Value': '26/100'}]",26,4.1,"106,375",tt11057302,movie,N/A,"$43,817,106",N/A,N/A,
757,"Sep 27, 2023",The Creator,"$80,000,000","$40,774,679","$104,272,136",True,,The Creator,2023,PG-13,29 Sep 2023,133 min,"Action, Adventure, Drama",Gareth Edwards,"Gareth Edwards, Chris Weitz","John David Washington, Madeleine Yuna Voyles, Gemma Chan","Against the backdrop of a war between humans and robots with artificial intelligence, a former soldier finds the robots' secret weapon to end the conflict, an AI in the form of a child.","English, Thai","United States, Cambodia, Japan",Nominated for 2 Oscars. 13 wins & 49 nominations total,https://m.media-amazon.com/images/M/MV5BMDkxMTUxOTQtYzM4Yi00YzA2LTgzOTYtNDg2NTliODE0ZTRjXkEyXkFqcGc@._V1_SX300.jpg,"[{'Source': 'Internet Movie Database', 'Value': '6.7/10'}, {'Source': 'Rotten Tomatoes', 'Value': '67%'}, {'Source': 'Metacritic', 'Value': '63/100'}]",63,6.7,"190,980",tt11858890,movie,N/A,"$40,774,679",N/A,N/A,
